title,link,address,description,price,price_weekly,date,seller,image,bed,type,lat_lon,lat,lon,sq_ft,nres
6 bedroom semi-detached house,https://www.rightmove.co.uk/properties/128665850#/?channel=STU_LET,"Twyford Road, Brighton, East Sussex, BN1","VIRTUAL TOUR | NO DEPOSIT OPTION BILLS INCLUDED AVAILABLE If living close to the university is important for you, then this SIX BEDROOM, FURNISHED STUDENT HOUSE is ideal as you are within walking distance of both Sussex and Brighton Universities and on the doorstep of the Varley camp...",3900.0,900.0,yesterday,"Brand Vaughan, Brighton",https://media.rightmove.co.uk:443/dir/crop/10:9-16:9/230k/229613/128665361/229613_BVB220003_L_IMG_00_0000_max_476x317.jpeg,6,house,"('50.83891575', '-0.12693054250074665')",50.83891575,-0.12693054250074665,,490
5 bedroom terraced house,https://www.rightmove.co.uk/properties/128665799#/?channel=STU_LET,"Bernard Road, Brighton",MODERN KITCHEN | FIVE DOUBLES | LOW MAINTENANCE GARDEN | BILLS INCLUDED OPTIONS AVAILABLE | ZERO DEPOSIT OPTION | MONTHLY GARDENER INCL | CONTENTS INSURANCE INCL | COAPT REF: 6700312 Great location! Five double bed student house in Elm Grove with a brand new kitchen! Bernard Road is a fant...,2795.0,645.0,yesterday,"Coapt, Brighton",https://media.rightmove.co.uk:443/dir/crop/10:9-16:9/75k/74542/128665283/74542_6700312_IMG_00_0000_max_476x317.jpeg,5,house,"('50.8328812', '-0.1199659')",50.8328812,-0.1199659,,490
5 bedroom detached house,https://www.rightmove.co.uk/properties/128665799#/?channel=STU_LET,"Elm Grove, Brighton","MODERN OPEN PLAN LIVING ROOM & KITCHEN | 5 DOUBLES | POPULAR ELM GROVE STUDENT LOCATION | 2 BATHROOMS | COAPT REF: 11261579 Top of the market student living! This fantastic five bedroom property on Elm Grove boasts loads of character and charm, combined with modern fixtures and fittings, for c...",3076.0,710.0,yesterday,"Coapt, Brighton",https://media.rightmove.co.uk:443/dir/crop/10:9-16:9/75k/74542/128665169/74542_11261579_IMG_00_0000_max_476x317.jpeg,5,house,"('50.8315719', '-0.1155375')",50.8315719,-0.1155375,,490
5 bedroom terraced house,https://www.rightmove.co.uk/properties/128665763#/?channel=STU_LET,"Islingword Road, Brighton",BRIGHT AND CHEERFUL HOME | 5 DOUBLES AND 2 BATHROOMS | ROOF TERRACE | LARGE LIVING ROOM | POPULAR HANOVER AREA | BILLS INCLUDED OPTIONS | ZERO DEPOSIT OPTION | | COAPT REF: 11628787 We are pleased to present this fun Hanover student property in an excellent location. On the ground floor ther...,2925.0,675.0,yesterday,"Coapt, Brighton",https://media.rightmove.co.uk:443/dir/crop/10:9-16:9/75k/74542/128665121/74542_11628787_IMG_00_0000_max_476x317.jpeg,5,house,"('50.8302369', '-0.1264091')",50.8302369,-0.1264091,,490
5 bedroom terraced house,https://www.rightmove.co.uk/properties/128665763#/?channel=STU_LET,"Canfield Road, Brighton",CLICK 3D TOUR LINK | FIVE DOUBLES AND TWO BATHROOMS | LARGE SEPARATE LIVING ROOM | FREE ON-STREET PARKING | BILLS INCLUDED OPTIONS AVAILABLE | COAPT REF: 6856129 This bright and airy terraced house is conveniently located in the student-friendly area of Coombe Road. The property is perfect for...,2925.0,675.0,yesterday,"Coapt, Brighton",https://media.rightmove.co.uk:443/dir/crop/10:9-16:9/75k/74542/128665025/74542_6856129_IMG_00_0000_max_476x317.jpeg,5,house,"('50.8405309', '-0.1154853')",50.8405309,-0.1154853,,490
5 bedroom semi-detached house,https://www.rightmove.co.uk/properties/128665724#/?channel=STU_LET,"The Avenue, Brighton",CLICK 3D TOUR LINK | MODERN KITCHEN | 4 DOUBLES | 2 BATHROOMS | BILLS INCLUDED OPTIONS AVAILABLE| MONTHLY GARDENER INCL | CONTENTS INSURANCE INCL | | COAPT REF: 6700683 This 5 bedroom furnished student house is situated in the centre of the very popular student friendly area of Bevendean. The...,2632.0,607.0,yesterday,"Coapt, Brighton",https://media.rightmove.co.uk:443/dir/crop/10:9-16:9/75k/74542/128664974/74542_6700683_IMG_00_0000_max_476x317.jpeg,5,house,"('50.8456307', '-0.1142961')",50.8456307,-0.1142961,,490
4 bedroom terraced house,https://www.rightmove.co.uk/properties/128665724#/?channel=STU_LET,"Crayford Road, Brighton","CLICK 3D TOUR LINK | MODERN KITCHEN | TV IN LIVING ROOM | OPEN PLAN LIVING SPACE | BILLS INCL OPTIONS AVAILABLE | ZERO DEPOSIT OPTION | GARDEN INCL OPTION | 4 DOUBLES | COAPT REF 6723422 This well presented, terraced, student residence is situated within the Coombe Road area, close to transpor...",2383.0,550.0,yesterday,"Coapt, Brighton",https://media.rightmove.co.uk:443/dir/crop/10:9-16:9/75k/74542/128664938/74542_6723422_IMG_00_0000_max_476x317.jpeg,4,house,"('50.8400645', '-0.114312')",50.8400645,-0.114312,,490
4 bedroom terraced house,https://www.rightmove.co.uk/properties/128665670#/?channel=STU_LET,"Buller Road, Brighton","CLICK THE LINK FOR 3D TOUR! | FOUR DOUBLE BEDROOMS | LARGE PRIVATE GARDEN | GREAT LOCATION CLOSE TO BRIGHTON UNI | MONTHLY GARDENER INCL | CONTENTS INSURANCE INCL | COAPT REF: 6704792 This charming, four double bedroom furnished house sits on a quiet residential street in the popular student C...",2427.0,560.0,yesterday,"Coapt, Brighton",https://media.rightmove.co.uk:443/dir/crop/10:9-16:9/75k/74542/128664857/74542_6704792_IMG_00_0000_max_476x317.jpeg,4,house,"('50.8409568', '-0.1181103')",50.8409568,-0.1181103,,490
5 bedroom end of terrace house,https://www.rightmove.co.uk/properties/128666510#/?channel=STU_LET,"Queens Park Road, Brighton","CLICK LINK FOR 3D TOUR | LOW MAINTENANCE GARDEN | 5 BED STUDENT HOUSE | GREAT LOCATION | TWO BATHROOMS | BILLS INCLUDED OPTIONS AVAILABLE | FOUR DOUBLES | LARGE COMMUNAL SPACE | COAPT REF: 9848870 This 5-bedroom student house is situated on Queens Park Road, in the popular Elm Grove area. The ...",2773.0,640.0,yesterday,"Coapt, Brighton",https://media.rightmove.co.uk:443/dir/crop/10:9-16:9/75k/74542/128666510/74542_9848870_IMG_00_0000_max_476x317.jpeg,5,house,"('50.8198157', '-0.139904')",50.8198157,-0.139904,,490
4 bedroom terraced house,https://www.rightmove.co.uk/properties/128666510#/?channel=STU_LET,"Brewer Street, Brighton","CLICK 3D TOUR LINK | SEPARATE LIVING ROOM | 4 DOUBLES | BILLS INCLUDED OPTION | GARDENER INCL | CONTENTS INSURANCE INCL | COAPT REF: 6698230 Situated in a sought after area off of Lewes Road, just a 10 minute walk into central Brighton and close to great bus links to both universities, is this...",2392.0,552.0,yesterday,"Coapt, Brighton",https://media.rightmove.co.uk:443/dir/crop/10:9-16:9/75k/74542/128664815/74542_6698230_IMG_00_0000_max_476x317.jpeg,4,house,"('50.8336597', '-0.129822')",50.8336597,-0.129822,,490
4 bedroom terraced house,https://www.rightmove.co.uk/properties/128664815#/?channel=STU_LET,"Washington Street, Brighton",CLICK LINK TO 3D TOUR | FOUR SPACIOUS DOUBLE BEDROOMS | MODERN CONTEMPORARY KITCHEN AND INTERIOR THROUGHOUT | BILLS INCLUDED OPTIONS AVAILABLE | EXCELLENT STUDENT LOCATION | CLOSE TO SEAFRONT AND CITY CENTRE | COAPT REF 6700918 This traditional four double bedroom townhouse sits in the heart o...,2375.0,548.0,yesterday,"Coapt, Brighton",https://media.rightmove.co.uk:443/dir/crop/10:9-16:9/75k/74542/128664614/74542_6700918_IMG_00_0000_max_476x317.jpeg,4,house,"('50.830018', '-0.1284991')",50.830018,-0.1284991,,490
4 bedroom end of terrace house,https://www.rightmove.co.uk/properties/128664815#/?channel=STU_LET,"White Street, Brighton","CLICK THE LINK FOR 3D TOUR | BRILLIANT LOCATION | VIBRANT KITCHEN | LOW MAINTENANCE GARDEN | BILLS INCLUDED OPTIONS AVAILABLE | ZERO DEPOSIT OPTION | 3 DOUBLES | COAPT REF: 6698049 This traditional, four-bedroom Brighton townhouse sits in the heart of the city. With great access to numerous pu...",2340.0,540.0,yesterday,"Coapt, Brighton",https://media.rightmove.co.uk:443/dir/crop/10:9-16:9/75k/74542/128664488/74542_6698049_IMG_00_0000_max_476x317.jpeg,4,house,"('50.8223425', '-0.132223')",50.8223425,-0.132223,,490
4 bedroom semi-detached house,https://www.rightmove.co.uk/properties/128664614#/?channel=STU_LET,"Norwich Drive, Brighton","4 DOUBLES AND 2 BATHROOMS | SPACIOUS LIVING ROOM AND KITCHEN | BILLS INCLUDED OPTION | ZERO DEPOSIT OPTION | CONTENTS INSURANCE AND GARDENER INCL | CLICK 3D TOUR LINK | COAPT REF: 6704729 This excellent 4 bedroom house is situated in the area of Bevendean, with nearby bus links in walking dist...",2080.0,480.0,yesterday,"Coapt, Brighton",https://media.rightmove.co.uk:443/dir/crop/10:9-16:9/75k/74542/128664350/74542_6704729_IMG_00_0000_max_476x317.jpeg,4,house,"('50.844107', '-0.0940847')",50.844107,-0.0940847,,490
4 bedroom detached house,https://www.rightmove.co.uk/properties/128664614#/?channel=STU_LET,"Hawkhurst Road, Brighton","CLICK THE LINK FOR 3D TOUR | LARGE GARDEN | SPACIOUS LIVING ROOM | CLOSE TO FALMER CAMPUSES | BILLS INCL OPTIONS AVAILABLE | MONTHLY GARDENER INCLUDED | CONTENTS INSURANCE INCL | COAPT REF: 7633506 This fabulous 4 bed student house is located in Coldean, close to Varley Halls, Coldean library...",2080.0,480.0,yesterday,"Coapt, Brighton",https://media.rightmove.co.uk:443/dir/crop/10:9-16:9/75k/74542/128664311/74542_7633506_IMG_00_0000_max_476x317.jpeg,4,house,"('50.8629427', '-0.1095066')",50.8629427,-0.1095066,,490
4 bedroom terraced house,https://www.rightmove.co.uk/properties/128664488#/?channel=STU_LET,"Bentham Road, Brighton","GREAT TRANSPORT LINKS | LARGE PROPERTY | MODERN KITCHEN | 4 DOUBLES | CLOSE TO LOCAL AMENITIES | BILLS INCL OPTION | COAPT REF: 6723382 Stunning 4 double bedroom student house situated on Elm grove, home to great transport links to both Universities, as well as the rest of the city, and popul...",2357.0,544.0,yesterday,"Coapt, Brighton",https://media.rightmove.co.uk:443/dir/crop/10:9-16:9/75k/74542/128664299/74542_6723382_IMG_00_0000_max_476x317.jpeg,4,house,"('50.8297631', '-0.1232237')",50.8297631,-0.1232237,,490
4 bedroom terraced house,https://www.rightmove.co.uk/properties/128664488#/?channel=STU_LET,"Coombe Terrace, Brighton","CLICK 3D TOUR LINK | 4 DOUBLES | NEWLY REDECORATED THROUGHOUT | SPACIOUS LIVING AREA | BILLS INCL OPTIONS AVAILABLE | CONTENTS INSURANCE INCL | COAPT REF: 6700558 This excellent four double bedroom, part furnished house is in a prime location on Lewes Road. Just a ten-minute walk into central...",2245.0,518.0,yesterday,"Coapt, Brighton",https://media.rightmove.co.uk:443/dir/crop/10:9-16:9/75k/74542/128664203/74542_6700558_IMG_00_0000_max_476x317.jpeg,4,house,"('50.8399432', '-0.1224705')",50.8399432,-0.1224705,,490
4 bedroom semi-detached house,https://www.rightmove.co.uk/properties/128664350#/?channel=STU_LET,"Stonecross Road, Brighton","SPACIOUS PROPERTY | PERFECT STUDENT LOCATION | 4 DOUBLES | PARKING ZONE D | ZERO DEPOSIT OPTION | GARDEN INCL & MONTHLY GARDENER INCLUDED | CONTENTS INSURANCE INCL | BILLS INCL OPTION | COAPT REF: 6698281 Excellent location for Sussex students! 4 double bedrooms, separate lounge and spacious ...",2132.0,492.0,yesterday,"Coapt, Brighton",https://media.rightmove.co.uk:443/dir/crop/10:9-16:9/75k/74542/128664140/74542_6698281_IMG_00_0000_max_476x317.jpeg,4,house,"('50.8543683', '-0.1002683')",50.8543683,-0.1002683,,490
4 bedroom terraced house,https://www.rightmove.co.uk/properties/128664350#/?channel=STU_LET,"St Mary Magdalene Street, ",CLICK 3D TOUR LINK | FOUR DOUBLES | SPACIOUS OPEN PLAN LIVING ROOM | EXCELLENT LOCATION NEXT TO LEWES ROAD | BILLS INCLUDED OPTIONS AVAILABLE | ZERO DEPOSIT OPTION | MONTHLY GARDENER INCL | CONTENTS INSURANCE INCL | COAPT REF: 10674025 This traditional Brighton townhouse is in a central locati...,2409.0,556.0,yesterday,"Coapt, Brighton",https://media.rightmove.co.uk:443/dir/crop/10:9-16:9/75k/74542/128664080/74542_10674025_IMG_00_0000_max_476x317.jpeg,4,house,"('50.8345967', '-0.1278836')",50.8345967,-0.1278836,,490
4 bedroom terraced house,https://www.rightmove.co.uk/properties/128664311#/?channel=STU_LET,"Franklin Road, Brighton",CLICK LINK FOR A 3D TOUR | NEWLY REFURBISHED KITCHEN | 4 SPACIOUS DOUBLE BEDROOMS | BILLS INCLUDED OPTIONS AVAILABLE | CONTENTS INSURANCE AND GARDENER INCLUDED | ZERO DEPOSIT OPTION | EXCELLENT LOCATION | COAPT REF: 6701005 This top-of-the-range terraced house has been refurbished to a high s...,2591.0,598.0,yesterday,"Coapt, Brighton",https://media.rightmove.co.uk:443/dir/crop/10:9-16:9/75k/74542/128663888/74542_6701005_IMG_00_0000_max_476x317.jpeg,4,house,"('50.833552', '-0.1252079')",50.833552,-0.1252079,,490
4 bedroom terraced house,https://www.rightmove.co.uk/properties/128664311#/?channel=STU_LET,"Baden Road, Brighton",CLICK 3D TOUR LINK | FANTASTIC OUTDOOR SPACE | FOUR DOUBLES | OPEN LIVING SPACE | BILLS INCL OPTIONS AVAILABLE | ZERO DEPOSIT OPTION | MONTHLY GARDENER INCLUDED | CONTENTS INSURANCE INCL | 4 DOUBLES | COAPT REF: 6697990 This four double bedroom house is situated just off of Coombe Road. Right...,2149.0,496.0,yesterday,"Coapt, Brighton",https://media.rightmove.co.uk:443/dir/crop/10:9-16:9/75k/74542/128663837/74542_6697990_IMG_00_0000_max_476x317.jpeg,4,house,"('50.838966', '-0.1138901')",50.838966,-0.1138901,,490
4 bedroom detached house,https://www.rightmove.co.uk/properties/128664299#/?channel=STU_LET,"Whippingham Street, Brighton","CLICK 3D TOUR LINK | ALL DOUBLE BEDROOMS | LOW MAINTENANCE GARDEN | SEPARATE LIVING ROOM | BILLS INCL OPTIONS AVAILABLE | CONTENTS INSURANCE INCL | COAPT REF: 10282495 This traditional four double bedroom, terraced house is located in the popular Elm Grove area which is popular with students....",2297.0,530.0,yesterday,"Coapt, Brighton",https://media.rightmove.co.uk:443/dir/crop/10:9-16:9/75k/74542/128663744/74542_10282495_IMG_00_0000_max_476x317.jpeg,4,house,"('50.8352607', '-0.1215073')",50.8352607,-0.1215073,,490
4 bedroom semi-detached house,https://www.rightmove.co.uk/properties/128664299#/?channel=STU_LET,"Eastbourne Road, Brighton","CLICK 3D TOUR LINK | NEWLY RENOVATED KITCHEN | PERFECT OFF CAMPUS ACCOMMODATION | 4 DOUBLES | ZERO DEPOSIT OPTION/GARDEN INCL | CONTENTS INSURANCE INCL | BILLS INCL OPTION | COAPT REF: 6697671 This excellent four double bedroom, furnished house is located on the popular Coombe Road. With loca...",2322.0,536.0,yesterday,"Coapt, Brighton",https://media.rightmove.co.uk:443/dir/crop/10:9-16:9/75k/74542/128663714/74542_6697671_IMG_00_0000_max_476x317.jpeg,4,house,"('50.8402829', '-0.1134214')",50.8402829,-0.1134214,,490
3 bedroom flat,https://www.rightmove.co.uk/properties/128664203#/?channel=STU_LET,"Park Crescent Place, Brighton",CLICK 3D TOUR LINK | ALL DOUBLE BEDROOMS | CLOSE TO CITY CENTRE & TRANSPORT LINKS | BILLS INCLUDED OPTIONS AVAILABLE | CONTENTS INSURANCE INCLUDED | COAPT REF: 6700815 This three double bedroom flat is situated just off of Park Crescent in Devonian Court. Right on the doorstep is a wide varie...,1774.0,409.0,yesterday,"Coapt, Brighton",https://media.rightmove.co.uk:443/dir/crop/10:9-16:9/75k/74542/128663657/74542_6700815_IMG_00_0000_max_476x317.jpeg,3,flat,"('50.8330185', '-0.1297723')",50.8330185,-0.1297723,,490
3 bedroom end of terrace house,https://www.rightmove.co.uk/properties/128664203#/?channel=STU_LET,"Robertson Road, Brighton",THREE DOUBLE BEDROOMS | EXCEPTIONAL TRANSPORT LINKS| PRIME LOCATION | FIVE MINUTE WALK TO LOCAL SHOPS AND PRESTON PARK TRAIN STATION | SHORT WALK INTO THE CENTRE OF BRIGHTON | COAPT REF: 6699904 This charming characteristic superb three double bedroom end of terrace property. is located down q...,1880.0,434.0,yesterday,"Coapt, Brighton",https://media.rightmove.co.uk:443/dir/crop/10:9-16:9/75k/74542/128663612/74542_6699904_IMG_00_0000_max_476x317.jpeg,3,house,"('50.8433667', '-0.1550793')",50.8433667,-0.1550793,,490
3 bedroom terraced house,https://www.rightmove.co.uk/properties/128664140#/?channel=STU_LET,"Nesbitt Road, Brighton","CLICK 3D TOUR LINK | SEPARATE LIVING ROOM | ALL DOUBLE BEDROOMS | PRIVATE GARDEN | EXCELLENT LOCATION | TV IN EACH BEDROOM | BILLS INCLUDED OPTIONS AVAILABLE | CONTENTS INSURANCE INCL | COAPT REF: 6700786 On a quiet residential street in a popular student area, sits this charming, three double...",1982.0,457.0,yesterday,"Coapt, Brighton",https://media.rightmove.co.uk:443/dir/crop/10:9-16:9/75k/74542/128663498/74542_6700786_IMG_00_0000_max_476x317.jpeg,3,house,"('50.8405884', '-0.1174241')",50.8405884,-0.1174241,,490
3 bedroom house of multiple occupation,https://www.rightmove.co.uk/properties/128664140#/?channel=STU_LET,"Eastbourne Road, Brighton",CLICK 3D TOUR LINK | 3 DOUBLES | SEPARATE LIVING ROOM | SEPARATE STUDY ROOM | LARGE GARDEN PERFECT FOR SUMMER | CLOSE TO LEWES ROAD AND LOCAL AMENITIES | ZERO DEPOSIT OPTION | CONTENTS INSURANCE INCL | BILLS INCL OPTION | COAPT REF: 6700645 Superb 3 bed on Eastbourne Road near Coombe Road! T...,1937.0,447.0,yesterday,"Coapt, Brighton",https://media.rightmove.co.uk:443/dir/crop/10:9-16:9/75k/74542/128663402/74542_6700645_IMG_00_0000_max_476x317.jpeg,3,occupation,"('50.8402829', '-0.1134214')",50.8402829,-0.1134214,,490
3 bedroom terraced house,https://www.rightmove.co.uk/properties/128664080#/?channel=STU_LET,"Kimberley Road, Brighton","EXCELLENT LOCATION TO UNIVERSITY | SPACIOUS THREE DOUBLE BEDROOMS| FEW MINUTES WALK AWAY FROM LOCAL AMENITIES | FIVE MINUTE WALK FROM GREAT TRANSPORT LINKS INTO THE CITY CENTRE | COAPT REF: 6723368 Lovely characteristic charming mid- terrace house, benefits from spacious three double bedrooms....",1911.0,441.0,yesterday,"Coapt, Brighton",https://media.rightmove.co.uk:443/dir/crop/10:9-16:9/75k/74542/128663288/74542_6723368_IMG_00_0000_max_476x317.jpeg,3,house,"('50.8387423', '-0.1176919')",50.8387423,-0.1176919,,490
3 bedroom flat,https://www.rightmove.co.uk/properties/128664080#/?channel=STU_LET,"Park Crescent Place, Brighton",CLICK 3D TOUR LINK | ALL DOUBLE BEDROOMS | CLOSE TO CITY CENTRE & TRANSPORT LINKS | BILLS INCLUDED OPTIONS AVAILABLE | CONTENTS INSURANCE INCLUDED | COAPT REF: 6700782 This alluring three double bedroom flat is situated just off of park crescent in the tranquil Devonian Court. Right on the do...,1774.0,409.0,yesterday,"Coapt, Brighton",https://media.rightmove.co.uk:443/dir/crop/10:9-16:9/75k/74542/128663168/74542_6700782_IMG_00_0000_max_476x317.jpeg,3,flat,"('50.8330185', '-0.1297723')",50.8330185,-0.1297723,,490
3 bedroom house of multiple occupation,https://www.rightmove.co.uk/properties/128663888#/?channel=STU_LET,"Mafeking Road, Brighton","CLICK LINK FOR 3D TOUR | ALL DOUBLE BEDROOMS | SEPARATE LIVING ROOM | GREAT STUDENT LOCATION | CONTENTS INSURANCE AND MONTHLY GARDENER INCLUDED | BILLS INCLUDED OPTIONS AVAILABLE | COAPT REF: 6699628 This terraced house is positioned in the popular student area of Coombe Road, a short walk fro...",1859.0,429.0,yesterday,"Coapt, Brighton",https://media.rightmove.co.uk:443/dir/crop/10:9-16:9/75k/74542/128663093/74542_6699628_IMG_00_0000_max_476x317.jpeg,3,occupation,"('50.8389872', '-0.11957')",50.8389872,-0.11957,,490
3 bedroom detached house,https://www.rightmove.co.uk/properties/128663888#/?channel=STU_LET,"St Paul's Street, Brighton","CLICK LINK FOR 3D TOUR | EXCELLENT LOCATION TO BRIGHTON UNIVERSITY | THREE DOUBLE BEDROOMS | PERMIT PARKING | ZERO DEPOSIT OPTION | BILLS INCLUDED OPTION | CONTENTS INSURANCE | COAPT REF: 10673967 This spacious 3-bedroom property is spread over three floors, providing a large amount of room an...",1846.0,426.0,yesterday,"Coapt, Brighton",https://media.rightmove.co.uk:443/dir/crop/10:9-16:9/75k/74542/128663057/74542_10673967_IMG_00_0000_max_476x317.jpeg,3,house,"('50.8345578', '-0.1286572')",50.8345578,-0.1286572,,490
3 bedroom terraced house,https://www.rightmove.co.uk/properties/128663837#/?channel=STU_LET,"Edinburgh Road, Brighton","CLICK LINK FOR 3D TOUR | ALL DOUBLE BEDROOMS | PRIME STUDENT LOCATION | SHORT WALK TO CITY CENTRE | LOW MAINTENANCE GARDEN, PERFECT FOR SUMMER EVENINGS | BILLS INCL OPTIONS | CONTENTS INSURANCE INCL | COAPT REF: 6701181 This exceptional three double bedroom, terraced house is in a prime locat...",1879.0,434.0,yesterday,"Coapt, Brighton",https://media.rightmove.co.uk:443/dir/crop/10:9-16:9/75k/74542/128662655/74542_6701181_IMG_00_0000_max_476x317.jpeg,3,house,"('50.8355037', '-0.1275325')",50.8355037,-0.1275325,,490
3 bedroom flat,https://www.rightmove.co.uk/properties/128663837#/?channel=STU_LET,"Queensway, Brighton",ZERO DEPOSIT AND BILLS INCL OPTIONS AVAILABLE/CONTENTS INSURANCE INCL/3 DOUBLES/CLICK 3D TOUR LINK/COAPT REF: 8905835 This lovely three double bedroom flat is situated just a short walk from Kemptown and the Royal Sussex County Hospital. The property is in great condition throughout and comes...,1645.0,380.0,yesterday,"Coapt, Brighton",https://media.rightmove.co.uk:443/dir/crop/10:9-16:9/75k/74542/128662571/74542_8905835_IMG_00_0000_max_476x317.jpeg,3,flat,"('53.480567', '-3.0165007')",53.480567,-3.0165007,,490
3 bedroom flat,https://www.rightmove.co.uk/properties/128663744#/?channel=STU_LET,"Coombe Road, Brighton","SPACIOUS MODERN FLAT | 3 DOUBLES | ZERO DEPOSIT OPTION | CONTENTS INSURANCE INCL | BILLS INCL OPTION | COAPT REF: 6700594 This alluring three double bedroom flat is in an area popular with students on Lewes Road. Right on the doorstep is a wide variety of local amenities, Brighton University and...",1852.0,427.0,yesterday,"Coapt, Brighton",https://media.rightmove.co.uk:443/dir/crop/10:9-16:9/75k/74542/128662409/74542_6700594_IMG_00_0000_max_476x317.jpeg,3,flat,"('50.8394639', '-0.1180318')",50.8394639,-0.1180318,,490
3 bedroom flat,https://www.rightmove.co.uk/properties/85925154#/?channel=STU_LET,"Craven Road, Brighton",BILLS INCL OPTION/CONTENTS INSURANCE INCL/3 DOUBLES/CLICK 3D TOUR LINK/COAPT REF: 8357599 This lovely three double bedroom flat is situated just a short walk from Kemptown and the Royal Sussex County Hospital. The property is in great condition throughout and is offered fully furnished. Sp...,1579.0,364.0,01/11/2022,"Coapt, Brighton",https://media.rightmove.co.uk:443/dir/crop/10:9-16:9/75k/74542/85925154/74542_8357599_IMG_00_0000_max_476x317.jpeg,3,flat,"('50.8252874', '-0.1171354')",50.8252874,-0.1171354,,490
3 bedroom terraced house,https://www.rightmove.co.uk/properties/85925154#/?channel=STU_LET,"Ladysmith Road, Brighton",CLICK THE LINK FOR 3D TOUR | LARGE GARDEN PERFECT FOR SUMMER | GREAT STUDENT LOCATION | BILLS INCLUDED OPTIONS AVAILABLE | ZERO DEPOSIT OPTION | MONTHLY GARDENER INCLUDED | CONTENTS INSURANCE INCLUDED | PERMIT PARKING | COAPT REF: 6700911 Located in the popular student area just of coombe roa...,1807.0,417.0,yesterday,"Coapt, Brighton",https://media.rightmove.co.uk:443/dir/crop/10:9-16:9/75k/74542/128662307/74542_6700911_IMG_00_0000_max_476x317.jpeg,3,house,"('50.8379505', '-0.1180695')",50.8379505,-0.1180695,,490
3 bedroom terraced house,https://www.rightmove.co.uk/properties/128662307#/?channel=STU_LET,"Redvers Road, Brighton","THREE DOUBLE BEDROOMS | RECENTLY REFURBISHED BATHROOM | BILLS INCLUDED OPTION| ZERO DEPOSIT OPTION | MONTHLY GARDENER INCLUDED | CONTENTS INSURANCE INCLUDED | COAPT REF: 6700801 This excellent three double bedroom, furnished house is in a prime location next to Brighton University. Just a ten ...",1911.0,441.0,yesterday,"Coapt, Brighton",https://media.rightmove.co.uk:443/dir/crop/10:9-16:9/75k/74542/128662223/74542_6700801_IMG_00_0000_max_476x317.jpeg,3,house,"('50.841121', '-0.1189797')",50.841121,-0.1189797,,490
2 bedroom flat,https://www.rightmove.co.uk/properties/128662307#/?channel=STU_LET,"Grosvenor Street, Brighton","TWO DOUBLE BEDROOMS | BALCONY WITH SEA VIEWS! | OPEN PLAN KITCHEN & LIVING AREA | GREAT CENTRAL LOCATION | CONTENTS INSURANCE INCL | COAPT REF: 6841265 A beautiful two double bedroom flat, located in the heart of traditional Kemptown. A few minutes walk to the hustle and bustle of St. James' S...",1452.0,335.0,yesterday,"Coapt, Brighton",https://media.rightmove.co.uk:443/dir/crop/10:9-16:9/75k/74542/128662190/74542_6841265_IMG_00_0000_max_476x317.jpeg,2,flat,"('50.8225706', '-0.1308489')",50.8225706,-0.1308489,,490
2 bedroom semi-detached house,https://www.rightmove.co.uk/properties/128662223#/?channel=STU_LET,"Monk Close, Brighton",SEPARATE LIVING ROOM | GARDENER INCLUDED | CONTENTS INSURANCE INCLUDED | LARGE OUTDOOR SPACE | SPACIOUS OFF-STREET PARKING | MODERN FURNISHING THROUGHOUT | COAPT REF 8935250 This spacious two-bedroom property is situated in the heart of Coldean. With a modern contemporary look throughout and a...,1356.0,313.0,yesterday,"Coapt, Brighton",https://media.rightmove.co.uk:443/dir/crop/10:9-16:9/75k/74542/128662094/74542_8935250_IMG_00_0000_max_476x317.jpeg,2,house,"('50.8620063', '-0.1102148')",50.8620063,-0.1102148,,490
2 bedroom maisonette,https://www.rightmove.co.uk/properties/128662223#/?channel=STU_LET,"Upper Lewes Road, Brighton","| 2 DOUBLES | ZERO DEPOSIT OPTION/GARDEN INCL | CONTENTS INSURANCE INCL | BILLS INCL OPTION | CLICK 3D TOUR LINK | COAPT REF: 6699856 This captivating two double bedroom, furnished flat is in a fantastic location on Upper Lewes Road. Just a ten minute walk into central Brighton, close to great b...",1426.0,329.0,yesterday,"Coapt, Brighton",https://media.rightmove.co.uk:443/dir/crop/10:9-16:9/75k/74542/128661977/74542_6699856_IMG_00_0000_max_476x317.jpeg,2,maisonette,"('50.8367327', '-0.1250518')",50.8367327,-0.1250518,,490
2 bedroom flat,https://www.rightmove.co.uk/properties/128662190#/?channel=STU_LET,"Selsfield Drive, Brighton","CLICK 3D TOUR LINK | 2 DOUBLES | INCREDIBLE LIVING ROOM | EXCELLENT STUDENT LOCATION | ZERO DEPOSIT OPTION | CONTENTS INSURANCE INCL | COAPT REF: 6701237 This attractive and spacious two double bedroom, ground floor flat is situated on Lewes Road. Right on the doorstep are regular bus links to...",1504.0,347.0,yesterday,"Coapt, Brighton",https://media.rightmove.co.uk:443/dir/crop/10:9-16:9/75k/74542/128661731/74542_6701237_IMG_00_0000_max_476x317.jpeg,2,flat,"('50.8479652', '-0.1133392')",50.8479652,-0.1133392,,490
