title,link,address,description,price,price_weekly,date,seller,image,bed,type,lat_lon,lat,lon,sq_ft,nres
2 bedroom flat,https://www.rightmove.co.uk/properties/128707784#/?channel=STU_LET,"Fleet Street, Brighton","CLICK 3D TOUR LINK | NEAR BRIGHTON TRAIN STATION | TWO DOUBLE BEDROOMS | TWO BATHROOMS | BALCONY | CONTENTS INSURANCE INCLUDED | COAPT REF: 6723221 This modern, trendy, two bedroom apartment is located within the ever more popular New England quarter of Brighton- only a few minutes walk from B...",1729.0,399.0,today,"Coapt, Brighton",https://media.rightmove.co.uk:443/dir/crop/10:9-16:9/75k/74542/128706653/74542_6723221_IMG_00_0000_max_476x317.jpeg,2,flat,"('50.8303336', '-0.1391589')",50.8303336,-0.1391589,,490
2 bedroom house of multiple occupation,https://www.rightmove.co.uk/properties/128707784#/?channel=STU_LET,"Birdham Road, Brighton",CLICK LINK FOR 3D TOUR | TWO DOUBLE BEDROOMS | SEPARATE SPACIOUS LIVING ROOM | LARGE GARDEN PERFECT FOR SUMMER! | ZERO DEPOSIT OPTION | CONTENTS INSURANCE INCL | BILLS INCL OPTION | COAPT REF: 6698250 Spacious two bedroom house not far from Brighton and Sussex University. The property offers two...,1296.0,299.0,today,"Coapt, Brighton",https://media.rightmove.co.uk:443/dir/crop/10:9-16:9/75k/74542/128706557/74542_6698250_IMG_00_0000_max_476x317.jpeg,2,occupation,"('50.8498549', '-0.1043958')",50.8498549,-0.1043958,,490
1 bedroom ground floor flat,https://www.rightmove.co.uk/properties/128707769#/?channel=STU_LET,"Clifton Road, Brighton, BN1","** 3D VIRTUAL TOUR AVAILABLE ** ** SPACIOUS // MODERN // CENTRAL ** A very spacious, stylish one bedroom apartment in this sought after area of Seven Dials. Close walking distance to Brighton Station, Brighton's famous seafront and the City Centre. Light and airy open plan kitchen/living room w...",1350.0,312.0,today,"Clarity, Brighton",https://media.rightmove.co.uk:443/dir/crop/10:9-16:9/208k/207860/128434499/207860_103339000011_IMG_00_0000_max_476x317.jpeg,1,flat,"('50.8282818', '-0.1487138')",50.8282818,-0.1487138,,490
Studio flat,https://www.rightmove.co.uk/properties/128707769#/?channel=STU_LET,"Lower Rock Gardens, Brighton","First floor compact studio flat, with separate kitchen and loft storage area Conveniently located less than five minutes’ walk to sea/Brighton pier. and 0.8 miles to Brighton train station Uniquely designed incorporating some stunning period features. Furnished and including home cinema, wash...",800.0,185.0,today,"Cocoon (UK), London",https://media.rightmove.co.uk:443/dir/crop/10:9-16:9/230k/229394/128705813/229394_874_IMG_00_0000_max_476x317.jpeg,studio,flat,"('50.8192675', '-0.1304479')",50.8192675,-0.1304479,,490
Studio flat,https://www.rightmove.co.uk/properties/128707679#/?channel=STU_LET,"Scarborough Road, Brighton",STUDIO FLAT | LARGE LIVING SPACE | SMALL PATIO AREA | DISHWASHER | WALKING DISTANCE TO PRESTON PARK STATION | CONTENTS INSURANCE INCL | COAPT REF: 6700142 Lovely studio flat located in a quiet residential area and just a couple of minutes walk from Preston Park. The property has the major adde...,843.0,195.0,today,"Coapt, Brighton",https://media.rightmove.co.uk:443/dir/crop/10:9-16:9/75k/74542/128703656/74542_6700142_IMG_00_0000_max_476x317.jpeg,studio,flat,"('50.8427417', '-0.1555802')",50.8427417,-0.1555802,,490
5 bedroom terraced house,https://www.rightmove.co.uk/properties/117239216#/?channel=STU_LET,"Queens Park Road, Brighton",CLICK LINK FOR 3D TOUR | LOW MAINTENANCE GARDEN | OPEN PLAN KITCHEN/LIVING ROOM | FIVE DOUBLES | TWO BATHROOMS THREE TOILETS | BILLS INCLUDED OPTION AVAILABLE | COAPT REF: 8455401 In the popular student area of Hanover is this expansive five double bedroom townhouse. Located on Queens Park roa...,3142.0,725.0,yesterday,"Coapt, Brighton",https://media.rightmove.co.uk:443/dir/crop/10:9-16:9/75k/74542/117239216/74542_8455401_IMG_10_0000_max_476x317.jpeg,5,house,"('50.8198157', '-0.139904')",50.8198157,-0.139904,,490
6 bedroom terraced house,https://www.rightmove.co.uk/properties/117239216#/?channel=STU_LET,"Warleigh Road , Brighton","Situated 5 minutes away from the corner of London Road, 2 minutes away from London Road train station and only a 10 minute walk from both Brighton train station, and local bus stops to both Brighton and Sussex Uni´s, this beautiful three storey Victorian style house is perfect for University...",3640.0,840.0,today,"Kendrick Property Services, Brighton",https://media.rightmove.co.uk:443/dir/crop/10:9-16:9/18k/17969/128703419/17969_101297005192_IMG_00_0000_max_476x317.jpeg,6,house,"('50.8351423', '-0.1353009')",50.8351423,-0.1353009,,490
6 bedroom terraced house,https://www.rightmove.co.uk/properties/128703419#/?channel=STU_LET,"Clyde Road , Brighton","Situated on the corner of London Road, 2 minutes away from London Road train station and only a 10 minute walk from both Brighton train station, and local bus stops to both Brighton and Sussex Uni´s, this beautiful three storey Victorian style house is perfect for University students. AVAIL...",3640.0,840.0,today,"Kendrick Property Services, Brighton",https://media.rightmove.co.uk:443/dir/crop/10:9-16:9/18k/17969/128702984/17969_101297005187_IMG_00_0000_max_476x317.jpeg,6,house,"('50.8348878', '-0.1364993')",50.8348878,-0.1364993,,490
5 bedroom terraced house,https://www.rightmove.co.uk/properties/128703419#/?channel=STU_LET,"Montreal Road , Brighton","This spacious three story house is situated minutes from Elm Grove, is a prefect location for university students, with Brighton Station being only a 20 minute walk away, The Grand Parade campus and Brighton hospital is only 10 mins walk. With this great location you are within half an hour from ...",2925.0,675.0,today,"Kendrick Property Services, Brighton",https://media.rightmove.co.uk:443/dir/crop/10:9-16:9/18k/17969/128702873/17969_101297005185_IMG_00_0000_max_476x317.jpeg,5,house,"('50.8274472', '-0.1277027')",50.8274472,-0.1277027,,490
6 bedroom terraced house,https://www.rightmove.co.uk/properties/128702984#/?channel=STU_LET,"Caledonian Road, Brighton","This is a rare gem of a student house, as each of the 6 large double bedrooms has it´s own en-suite! So there will be no fight for who gets which room! As well as a huge kitchen, separate lounge, garden and great location, continue reading to see if this could be your new home! AVAILABLE ; ...",3718.0,858.0,today,"Kendrick Property Services, Brighton",https://media.rightmove.co.uk:443/dir/crop/10:9-16:9/18k/17969/128702630/17969_101297005180_IMG_00_0000_max_476x317.jpeg,6,house,"('50.834572', '-0.1267007')",50.834572,-0.1267007,,490
6 bedroom terraced house,https://www.rightmove.co.uk/properties/128702984#/?channel=STU_LET,"Argyle Road, Brighton","Situated on the corner of London Road, 3 minutes away from London Road train station and only a 8 minute walk from both Brighton train station, and local bus stops to both Brighton and Sussex Uni´s, this beautiful four story Victorian style house is perfect for University students. AVAILABL...",3510.0,810.0,today,"Kendrick Property Services, Brighton",https://media.rightmove.co.uk:443/dir/crop/10:9-16:9/18k/17969/128702516/17969_101297005179_IMG_00_0000_max_476x317.jpeg,6,house,"('50.8351103', '-0.1412373')",50.8351103,-0.1412373,,490
6 bedroom terraced house,https://www.rightmove.co.uk/properties/128702873#/?channel=STU_LET,"Campbell Road, Brighton","Situated on the corner of London Road, 3 minutes away from London Road train station and only a 8 minute walk from both Brighton train station, and local bus stops to both Brighton and Sussex Uni´s, this beautiful three storey Victorian style house is perfect for University students. AVAILA...",3510.0,810.0,today,"Kendrick Property Services, Brighton",https://media.rightmove.co.uk:443/dir/crop/10:9-16:9/18k/17969/128702423/17969_101297005178_IMG_00_0000_max_476x317.jpeg,6,house,"('50.8341686', '-0.1409759')",50.8341686,-0.1409759,,490
6 bedroom mews house,https://www.rightmove.co.uk/properties/128702873#/?channel=STU_LET,"Blaker Street, Brighton","The famous brightly coloured house street that appears on Brighton postcards could be the location of your new home! Just a 5 minute walk from Brighton Beach, this beautiful three story house is perfect for a group of 6 looking for their new seaside home. AVAILABLE ; 14th July 2023, £130 P...",3380.0,780.0,today,"Kendrick Property Services, Brighton",https://media.rightmove.co.uk:443/dir/crop/10:9-16:9/18k/17969/128702288/17969_101297005177_IMG_00_0000_max_476x317.jpeg,6,house,"('50.8222343', '-0.1316238')",50.8222343,-0.1316238,,490
6 bedroom semi-detached house,https://www.rightmove.co.uk/properties/128702630#/?channel=STU_LET,"The Avenue, Brighton","In a prime location, just an 8 minute walk to lewes road and moulscoombe campus, this property is the peak of student property in brighton! Having just been completely refurbished throughout this summer, the house is in stunning condition. The property features a capacious and warm living area...",2574.0,594.0,today,"Coapt, Brighton",https://media.rightmove.co.uk:443/dir/crop/10:9-16:9/75k/74542/116520314/74542_6701616_IMG_00_0000_max_476x317.jpeg,6,house,"('50.8456307', '-0.1142961')",50.8456307,-0.1142961,,490
6 bedroom semi-detached house,https://www.rightmove.co.uk/properties/128702630#/?channel=STU_LET,"Park Road, Brighton","This elegant six bed property offers great value for money with a considerable amount of space both inside and out. It has both private and on street parking as well as being only a two-minute walk to the bus stop, this residence is perfect for students travelling to both Sussex University and Br...",2990.0,690.0,today,"Coapt, Brighton",https://media.rightmove.co.uk:443/dir/crop/10:9-16:9/75k/74542/116520380/74542_6704508_IMG_00_0000_max_476x317.jpeg,6,house,"('50.8587881', '-0.1032873')",50.8587881,-0.1032873,,490
8 bedroom terraced house,https://www.rightmove.co.uk/properties/128702516#/?channel=STU_LET,"Upper Lewes Road, Brighton","CLICK 3D TOUR LINK | TWO MODERN KITCHENS | LOW MAINTENANCE GARDEN | BREAKFAST BAR | EIGHT DOUBLES | COAPT REF: 6716750 This expansive eight double bedroom terraced house is located on Upper Lewes road, just a 10 minute walk to central Brighton, great local amenities and close to bus links to b...",5131.0,1184.0,today,"Coapt, Brighton",https://media.rightmove.co.uk:443/dir/crop/10:9-16:9/75k/74542/128698697/74542_6716750_IMG_00_0000_max_476x317.jpeg,8,house,"('50.8367327', '-0.1250518')",50.8367327,-0.1250518,,490
8 bedroom detached house,https://www.rightmove.co.uk/properties/128702516#/?channel=STU_LET,"Auckland Drive, Brighton","CLICK 3D TOUR LINK | MODERN THROUGHOUT | 8 DOUBLE BEDROOMS ALL WITH EN-SUITES | OFF STREET PARKING SPACE | BILLS INCLUDED OPTION AVAILABLE | MONTHLY GARDENER INCLUDED | CONTENTS INSURANCE INCLUDED | COAPT REF: 6698218 This luxurious, detached property has recently is modern throughout and boa...",4853.0,1120.0,today,"Coapt, Brighton",https://media.rightmove.co.uk:443/dir/crop/10:9-16:9/75k/74542/128698490/74542_6698218_IMG_00_0000_max_476x317.jpeg,8,house,"('50.8404999', '-0.1011873')",50.8404999,-0.1011873,,490
8 bedroom semi-detached house,https://www.rightmove.co.uk/properties/128702423#/?channel=STU_LET,"Lucraft Road, Brighton",CLICK 3D TOUR LINK | ALL DOUBLE BEDROOMS | SPACIOUS LIVING SPACES | PRIVATE PARKING SPACE | CLOSE TO MOULSECOOMB & FALMER CAMPUS | FRONT AND REAR GARDEN | ZERO DEPOSIT OPTION | GARDENER INCLUDED | CONTENTS INSURANCE INCLUDED | BILLS INCLUDED OPTION AVAILABLE | COAPT REF: 6701426 This superb e...,4264.0,984.0,today,"Coapt, Brighton",https://media.rightmove.co.uk:443/dir/crop/10:9-16:9/75k/74542/128698403/74542_6701426_IMG_00_0000_max_476x317.jpeg,8,house,"('50.8576351', '-0.0964056')",50.8576351,-0.0964056,,490
8 bedroom end of terrace house,https://www.rightmove.co.uk/properties/128702423#/?channel=STU_LET,"Lewes Road, Brighton","CLICK 3D TOUR LINK | LARGE KICHEN/SOCIAL SPACE | GREAT LOCATION FOR SUPERMARKETS AND TRAVEL LINKS | THREE BATHROOMS | BILLS INCLUDED OPTION AVAILABLE | COAPT REF: 6698041 This contemporary, eight double bedroom property is situated on Lewes Road. Right on the doorstep is a wide variety of loc...",5027.0,1160.0,today,"Coapt, Brighton",https://media.rightmove.co.uk:443/dir/crop/10:9-16:9/75k/74542/128697974/74542_6698041_IMG_00_0000_max_476x317.jpeg,8,house,"('50.8375717', '-0.1266512')",50.8375717,-0.1266512,,490
1 bedroom apartment,https://www.rightmove.co.uk/properties/128702288#/?channel=STU_LET,"Windsor Court, Windsor Street, Brighton","VIDEO LINK ** Available Now ** Stanfords are offing a new one double bedroom 4th floor flat located in central Brighton, moments from Churchill Square and Brighton Station. Comprising of open plan living and kitchen with integrated appliances, bathroom and double bedroom. The property can be furn...",1250.0,288.0,today,"Stanfords Estates, Brighton",https://media.rightmove.co.uk:443/dir/crop/10:9-16:9/110k/109519/78128263/109519_100276003187_IMG_01_0000_max_476x317.jpg,1,apartment,"('50.83891575', '-0.12693054250074665')",50.83891575,-0.12693054250074665,,490
3 bedroom flat,https://www.rightmove.co.uk/properties/128702288#/?channel=STU_LET,"Southmount, Brighton, BN1","VIDEO TOUR AVAILABLE | BILLS INCLUSIVE OPTION | This modern student apartment sits in a quiet residential area and is fantastically located for the Moulsecoomb and Falmer Campus by walking or by bus, and has excellent bus links for Central Brighton.",1900.0,438.0,today,"Brand Vaughan, Brighton",https://media.rightmove.co.uk:443/dir/crop/10:9-16:9/230k/229613/128694317/229613_BVB190150_L_IMG_00_0000_max_476x317.jpeg,3,flat,"('50.8389791', '-0.1285178')",50.8389791,-0.1285178,,490
3 bedroom flat,https://www.rightmove.co.uk/properties/116520314#/?channel=STU_LET,"The Highway, Brighton, BN2","VIDEO TOUR | BILLS INCLUSIVE OPTION | For Brighton University students, you couldn't be in a better location, as the campus is just across the road, and for Sussex students, you can jump on a bus or a train, and arrive in minutes.",1900.0,438.0,today,"Brand Vaughan, Brighton",https://media.rightmove.co.uk:443/dir/crop/10:9-16:9/230k/229613/128693843/229613_BVB180058_L_IMG_00_0000_max_476x317.jpeg,3,flat,"('50.8468024', '-0.114875')",50.8468024,-0.114875,,490
5 bedroom terraced house,https://www.rightmove.co.uk/properties/116520314#/?channel=STU_LET,"Elm Grove, Brighton, BN2",NO DEPOSIT OPTION | BILLS INCLUSIVE AVAILABLE | CENTRAL LOCATION Elm Grove has been a popular student location for many years now due to its proximity to both the city and the university campuses.,2820.0,651.0,today,"Brand Vaughan, Brighton",https://media.rightmove.co.uk:443/dir/crop/10:9-16:9/230k/229613/128693375/229613_BVB210096_L_IMG_00_0000_max_476x317.jpeg,5,house,"('50.8314154', '-0.1190773')",50.8314154,-0.1190773,,490
5 bedroom end of terrace house,https://www.rightmove.co.uk/properties/116520380#/?channel=STU_LET,"First Avenue, Hove, East Sussex, BN3","STUDENT MAISONETTE | CENTRAL TO HOVE Tucked away from the hubbub of Church Road, but just minutes from the city centre, Hove Station and the beach, sits this incredible STUDENT house with five double bedrooms and two bathrooms.",2709.0,625.0,today,"Brand Vaughan, Brighton",https://media.rightmove.co.uk:443/dir/crop/10:9-16:9/230k/229613/128693102/229613_BHL210207_L_IMG_00_0000_max_476x317.jpeg,5,house,"('50.83891575', '-0.12693054250074665')",50.83891575,-0.12693054250074665,,490
4 bedroom terraced house,https://www.rightmove.co.uk/properties/116520380#/?channel=STU_LET,"Egginton Road, Brighton, BN2","VIRTUAL TOUR | NO DEPOSIT OPTION | BILLS PACKAGE AVAILABLE | This spacious student house sits perfectly positioned close to the road towards Lewes, so it is an easy walk to Sussex University at Falmer, or a quick cycle, train or bus ride to Brighton Uni campus at Moulsecoomb.",2167.0,500.0,today,"Brand Vaughan, Brighton",https://media.rightmove.co.uk:443/dir/crop/10:9-16:9/230k/229613/128690249/229613_BVB210225_L_IMG_00_0000_max_476x317.jpeg,4,house,"('50.8568498', '-0.0958967')",50.8568498,-0.0958967,,490
4 bedroom house,https://www.rightmove.co.uk/properties/128698697#/?channel=STU_LET,"Ringmer Drive, BRIGHTON","Fox & Sons are pleased to offer for let this four bedroom house ideally located in Bevendean, with easy access to the University and a short distance from Brighton Centre. The house benefits from a spacious sitting room with access to the large garden to the rear, separate fitted kitchen with app...",1900.0,438.0,today,"Fox & Sons - Lettings, Kemptown",https://media.rightmove.co.uk:443/dir/crop/10:9-16:9/84k/83587/128689151/83587_P3467E4601_IMG_00_0000_max_476x317.jpeg,4,house,"('50.855928', '-0.102203')",50.855928,-0.102203,,490
5 bedroom terraced house,https://www.rightmove.co.uk/properties/128698697#/?channel=STU_LET,"The Avenue, Brighton, BN2","5 BEDROOM STUDENT HOUSE | VIDEO TOUR | As student houses go - this one is both smart and spacious with room for five students all in double rooms. They share the use of two bathrooms with showers plus a separate WC, and there is a separate living room PLUS a spacious kitchen diner pro...",2925.0,675.0,today,"Brand Vaughan, Brighton",https://media.rightmove.co.uk:443/dir/crop/10:9-16:9/230k/229613/128688512/229613_BVB220025_L_IMG_00_0000_max_476x317.jpeg,5,house,"('50.8456307', '-0.1142961')",50.8456307,-0.1142961,,490
6 bedroom semi-detached house,https://www.rightmove.co.uk/properties/128698490#/?channel=STU_LET,"Barcombe Road, Brighton, East Sussex, BN1","VIDEO TOUR | NO DEPOSIT OPTION | AVAILABLE BILLS INCLUSIVE | This is an excellent six bed house just minutes from Sussex University Campus. It is well presented throughout, with practical and stylish wooden floors in most rooms, and the six double bedrooms have built in wardrobes.",3380.0,780.0,today,"Brand Vaughan, Brighton",https://media.rightmove.co.uk:443/dir/crop/10:9-16:9/230k/229613/128688377/229613_BVB190040_L_IMG_00_0000_max_476x317.jpeg,6,house,"('50.83891575', '-0.12693054250074665')",50.83891575,-0.12693054250074665,,490
6 bedroom bungalow,https://www.rightmove.co.uk/properties/128698490#/?channel=STU_LET,"Rushlake Close, Brighton, BN1","VIRTUAL TOUR | NO DEPOSIT OPTION | BILLS INCLUDED AVAILABLE If living close to the university is important for you, then this six bedroom, FURNISHED student house is ideal as you are within walking distance of both Sussex and Brighton Universities and on the doorstep of the Varley cam...",3380.0,780.0,today,"Brand Vaughan, Brighton",https://media.rightmove.co.uk:443/dir/crop/10:9-16:9/230k/229613/128688341/229613_BVB210148_L_IMG_00_0000_max_476x317.jpeg,6,bungalow,"('50.8597566', '-0.1062461')",50.8597566,-0.1062461,,490
5 bedroom semi-detached house,https://www.rightmove.co.uk/properties/128698403#/?channel=STU_LET,"Nyetimber Hill, Brighton, East Sussex, BN2",VIRTUAL TOUR | NO DEPOSIT OPTION | BILLS INCLUSIVE AVAILABLE | Peacefully perched up on the hill between Lewes Road and the countryside stands this substantial five bedroom student house. ,2900.0,669.0,today,"Brand Vaughan, Brighton",https://media.rightmove.co.uk:443/dir/crop/10:9-16:9/230k/229613/128688227/229613_BVB220004_L_IMG_00_0000_max_476x317.jpeg,5,house,"('50.83891575', '-0.12693054250074665')",50.83891575,-0.12693054250074665,,490
2 bedroom terraced house,https://www.rightmove.co.uk/properties/128661548#/?channel=STU_LET,"Monk Close, Brighton",CLICK 3D TOUR LINK | 2 DOUBLE BEDROOMS | SEPARATE LIVING ROOM & SEPARATE STUDY ROOM | ZERO DEPOSIT OPTION AVAILABLE | MONTHLY GARDENER INCLUDED | CONTENTS INSURANCE INCLUDED | BILLS INCL OPTION AVAILABLE | COAPT REF: 6701317 This two bedroom student property is located by the universities in C...,1209.0,279.0,yesterday,"Coapt, Brighton",https://media.rightmove.co.uk:443/dir/crop/10:9-16:9/75k/74542/128661548/74542_6701317_IMG_00_0000_max_476x317.jpeg,2,house,"('50.8620063', '-0.1102148')",50.8620063,-0.1102148,,490
3 bedroom flat,https://www.rightmove.co.uk/properties/128661548#/?channel=STU_LET,"Fitch Drive, Brighton",CLICK 3D TOUR LINK | SEPARATE SPACIOUS LIVING ROOM | CLOSE TO TRANSPORT LINKS | ZERO DEPOSIT OPTION | CONTENTS INSURANCE INCL | BILLS INCL OPTION | COAPT REF: 830688 This three bedroom flat is positioned in a prime student location; it has superb transport links to the city centre and is in wa...,1709.0,394.0,yesterday,"Coapt, Brighton",https://media.rightmove.co.uk:443/dir/crop/10:9-16:9/75k/74542/128676104/74542_7830688_IMG_00_0000_max_476x317.jpeg,3,flat,"('50.8403696', '-0.1046985')",50.8403696,-0.1046985,,490
3 bedroom house of multiple occupation,https://www.rightmove.co.uk/properties/128676104#/?channel=STU_LET,"Washington Street, Brighton","CLICK 3D TOUR LINK | SPACIOUS AND MODERN UNFURNISHED PROPERTY | 3 DOUBLES | ZERO DEPOSIT OPTION | MONTHLY GARDENER INCL | CONTENTS INSURANCE INCL | BILLS INCL OPTION | COAPT REF: 6700705 This fantastic 3 bedroom unfurnished student property, is in the heart of colourful Hanover and just a shor...",1937.0,447.0,yesterday,"Coapt, Brighton",https://media.rightmove.co.uk:443/dir/crop/10:9-16:9/75k/74542/128676038/74542_6700705_IMG_00_0000_max_476x317.jpeg,3,occupation,"('50.830018', '-0.1284991')",50.830018,-0.1284991,,490
4 bedroom terraced house,https://www.rightmove.co.uk/properties/128676104#/?channel=STU_LET,"Park Crescent Road, Brighton","CLICK 3D TOUR LINK | CENTRAL LOCATION | OPEN PLAN LIVING AREA | 4 DOUBLES | ZERO DEPOSIT OPTION/GARDEN INCL | CONTENTS INSURANCE INCL | BILLS INCL OPTION | COAPT REF: 6700887 This traditional, four double bedroom townhouse is located just off of Lewes road. With exceptional access to the vari...",2496.0,576.0,yesterday,"Coapt, Brighton",https://media.rightmove.co.uk:443/dir/crop/10:9-16:9/75k/74542/128676011/74542_6700887_IMG_00_0000_max_476x317.jpeg,4,house,"('50.8346176', '-0.1287935')",50.8346176,-0.1287935,,490
4 bedroom detached house,https://www.rightmove.co.uk/properties/128676038#/?channel=STU_LET,"Baden Road, Brighton",CLICK THE LINK FOR 3D TOUR | FOUR DOUBLE BEDROOMS | LARGE GARDEN PERFECT FOR SUMMER EVENINGS | RECENTLY REFURBISHED SHOWER ROOM | OPEN PLAN LIVING AREA | COAPT REF: 10431967 This fantastic 4 bedroom student property is located on Baden Road in the heart of Brighton's student community. The pro...,2262.0,522.0,yesterday,"Coapt, Brighton",https://media.rightmove.co.uk:443/dir/crop/10:9-16:9/75k/74542/128675957/74542_10431967_IMG_00_0000_max_476x317.jpeg,4,house,"('50.838966', '-0.1138901')",50.838966,-0.1138901,,490
4 bedroom semi-detached house,https://www.rightmove.co.uk/properties/128676038#/?channel=STU_LET,"Wolseley Road, Brighton",CLICK 3D TOUR LINK | ALL DOUBLE BEDROOMS | OFF STREET PARKING | SPACIOUS GARDEN | LARGE DECKING AREA PERFECT FOR SUMMER | SEPARATE LIVING ROOM | GARAGE INCLUDED - CAN BE USED AS A HOME GYM | CLOSE TO THE UNIVERSITIES | ZERO DEPOSIT OPTION/GARDEN INCL | CONTENTS INSURANCE INCL | BILLS INCL OPTION ...,2150.0,496.0,yesterday,"Coapt, Brighton",https://media.rightmove.co.uk:443/dir/crop/10:9-16:9/75k/74542/128675930/74542_6698186_IMG_00_0000_max_476x317.jpeg,4,house,"('50.8615806', '-0.1155301')",50.8615806,-0.1155301,,490
4 bedroom semi-detached house,https://www.rightmove.co.uk/properties/128676011#/?channel=STU_LET,"Arlington Crescent, Brighton",CLICK LINK FOR 3D TOUR | RECENTLY REFURBISHED | THREE DOUBLE BEDROOMS | CLOSE TO VARLEY HALLS | LARGE GARDEN PERFECT FOR SUMMER EVENINGS | MODERN BATHROOM | COAPT REF: 6707315 Located close to Varley Halls in a quiet residential area. The house has recently had work completed and is in excelle...,2167.0,500.0,yesterday,"Coapt, Brighton",https://media.rightmove.co.uk:443/dir/crop/10:9-16:9/75k/74542/128675906/74542_6707315_IMG_00_0000_max_476x317.jpeg,4,house,"('50.8597405', '-0.1085962')",50.8597405,-0.1085962,,490
5 bedroom semi-detached house,https://www.rightmove.co.uk/properties/128676011#/?channel=STU_LET,"Medmerry Hill, Brighton",CLICK 3D TOUR LINK | FIVE DOUBLES AND TWO BATHROOMS | NEW BATHROOM REFURBISHMENT | RECENT REDECORATION THROUGHOUT | BILLS INCLUDED OPTIONS AVAILABLE | ZERO DEPOSIT OPTION | MONTHLY GARDENER INCL | CONTENTS INSURANCE INCL | COAPT REF: 6723712 This property has recently benefited from redecorati...,2752.0,635.0,yesterday,"Coapt, Brighton",https://media.rightmove.co.uk:443/dir/crop/10:9-16:9/75k/74542/128675870/74542_6723712_IMG_00_0000_max_476x317.jpeg,5,house,"('50.8460184', '-0.108293')",50.8460184,-0.108293,,490
5 bedroom terraced house,https://www.rightmove.co.uk/properties/128675957#/?channel=STU_LET,"Shanklin Road, Brighton","CLICK LINK FOR 3D TOUR | FIVE DOUBLE BEDROOMS | TWO BATHROOMS | SEPARATE LIVING ROOM | GREAT CENTRAL LOCATION | LOW MAINTENANCE PATIO GARDEN | COAPT REF: 7621959 This contemporary, five bedroom townhouse sits just off of Lewes road. With exceptional access to the varied amenities of Lewes road...",3142.0,725.0,yesterday,"Coapt, Brighton",https://media.rightmove.co.uk:443/dir/crop/10:9-16:9/75k/74542/128675804/74542_7621959_IMG_00_0000_max_476x317.jpeg,5,house,"('50.8357253', '-0.1211669')",50.8357253,-0.1211669,,490
8 bedroom detached house,https://www.rightmove.co.uk/properties/128675957#/?channel=STU_LET,"Camelford Street, Brighton",SPACIOUS BEDROOMS l HEART OF KEMPTOWN l EXCELLENT TRANSPORT LINKS l EIGHT DOUBLES | CONTENTS INSURANCE INCLUDED | BILLS INCLUDED OPTION AVAILABLE | COAPT REF: 10391145 This colossal eight double bedroom Regency townhouse is located in the heart of Kemptown Village and close to Brighton sea fro...,5425.0,1252.0,yesterday,"Coapt, Brighton",https://media.rightmove.co.uk:443/dir/crop/10:9-16:9/75k/74542/128675717/74542_10391145_IMG_00_0000_max_476x317.jpeg,8,house,"('50.8199665', '-0.1330165')",50.8199665,-0.1330165,,490
