title,link,address,description,price,price_weekly,date,seller,image,bed,type,lat_lon,lat,lon,sq_ft,nres,demand_per,demand,demand_color
5 bedroom town house,https://www.rightmove.co.uk/properties/127823777#/?channel=STU_LET,"50 Estcourt Avenue, Headingley, Leeds, LS6 3ET","Located in the heart of Headingley, just 5 minutes from Becketts Park Campus and all the amenities Headingley has to offer, this 5 bedroom property is perfectly appointed for a student group. With a bright, spacious lounge area, it is perfect for entertaining and catching up with friends or settl...",2795.0,645.0,07/10/2022,"Pickard Leeds Limited, Leeds",https://media.rightmove.co.uk:443/dir/crop/10:9-16:9/13k/12786/127823777/12786_50EA_IMG_00_0000_max_476x317.jpeg,5,house,"('53.8191847', '-1.5857103')",53.8191847,-1.5857103,,2046,+52%,52.0,orange
6 bedroom terraced house,https://www.rightmove.co.uk/properties/127823777#/?channel=STU_LET,"Norwood Road, Hyde Park, Leeds, LS6","Available 1st July 2023. £110pppw or £133pppw with our unlimited usage gas, electric, water and internet bills included package. Six bedrooms. Three bathrooms. Good size kitchen and living room. Get in touch for more information or to book a viewing!",477.0,110.0,today,"Provision Properties, Leeds",https://media.rightmove.co.uk:443/dir/crop/10:9-16:9/148k/147863/128536646/147863_10031_673_EAF_103656_IMG_00_0000_max_476x317.jpeg,6,house,"('53.8136339', '-1.5743727')",53.8136339,-1.5743727,,2046,+52%,52.0,orange
8 bedroom terraced house,https://www.rightmove.co.uk/properties/128536646#/?channel=STU_LET,"Hessle Place, Hyde Park, Leeds, LS6","Available 1st July 2023. £98pppw or £122pppw with our unlimited usage gas, electric, water and internet bills included package. 8 double bedrooms. 2 bathrooms. LED TV included. Spacious lounge. Dining kitchen. Fully furnished. Modern appliances included. Bills included option available....",425.0,98.0,today,"Provision Properties, Leeds",https://media.rightmove.co.uk:443/dir/crop/10:9-16:9/148k/147863/128536622/147863_10031_388_EAF_103661_IMG_00_0000_max_476x317.jpeg,8,house,"('53.812229', '-1.5694404')",53.812229,-1.5694404,,2046,+52%,52.0,orange
7 bedroom terraced house,https://www.rightmove.co.uk/properties/128536646#/?channel=STU_LET,"Chestnut Avenue, Hyde Park, Leeds, LS6","Available 1st July 2023. £115pppw or £140pppw including gas, electric, water, internet. 7 bedrooms. 2 bathrooms. Fully furnished. Modern appliances included. Located in central Hyde Park close to the Leeds University. Viewing is highly recommended!",477.0,110.0,today,"Provision Properties, Leeds",https://media.rightmove.co.uk:443/dir/crop/10:9-16:9/148k/147863/128536625/147863_10031_505_EAF_103660_IMG_00_0000_max_476x317.jpeg,7,house,"('53.8132918', '-1.5690623')",53.8132918,-1.5690623,,2046,+52%,52.0,orange
10 bedroom semi-detached house,https://www.rightmove.co.uk/properties/128536622#/?channel=STU_LET,"North Grange Mount, Hyde Park, Leeds, LS6","Available 1st July 2023. £110pppw or £140pppw including bills gas, electric, water and internet. Massive semi-detached 10 bedroom house located just off Headingley Lane near the Hyde Park within walking distance to the University. This property compromises of two large open plan living ...",477.0,110.0,today,"Provision Properties, Leeds",https://media.rightmove.co.uk:443/dir/crop/10:9-16:9/148k/147863/128536589/147863_10031_164_EAF_103668_IMG_00_0000_max_476x317.jpeg,10,house,"('53.8214454', '-1.5681702')",53.8214454,-1.5681702,,2046,+52%,52.0,orange
2 bedroom house,https://www.rightmove.co.uk/properties/128536622#/?channel=STU_LET,"Royal Park Grove, Leeds, West Yorkshire",No summary available.,901.0,208.0,today,"Abode Leeds, Leeds",,2,house,"('53.8116019', '-1.5662196')",53.8116019,-1.5662196,,2046,+52%,52.0,orange
2 bedroom house,https://www.rightmove.co.uk/properties/128536625#/?channel=STU_LET,"Midland Passage TFF, Leeds, West Yorkshire","**STUDENT PROPERTY**
**BILLS INCLUSIVE PACKAGES AVAILABLE**
**UNIPOL GOLD** Hyde Park is the hub of student life in Leeds. It is a vibrant, enjoyable place to live that comes to life during term time. Late night Sainsbury`s trips, summer street BBQs and the `occasional` house party are sure to b...",910.0,210.0,today,"Abode Leeds, Leeds",https://media.rightmove.co.uk:443/dir/crop/10:9-16:9/194k/193922/128324732/193922_31042167_IMG_00_0000_max_476x317.jpeg,2,house,"('53.7974185', '-1.5437941')",53.7974185,-1.5437941,,2046,+52%,52.0,orange
2 bedroom house,https://www.rightmove.co.uk/properties/128536625#/?channel=STU_LET,"Bankfield Terrace, Leeds, West Yorkshire","**STUDENT PROPERTY & PROFESSIONALS**
**BILLS INCLUSIVE PACKAGES AVAILABLE**
**UNIPOL GOLD** Burley Park is a pleasant neighbourhood popular with students from all the universities. Its proximity to Burley Park Train Station makes it a particular favourite with Leeds Trinity students. Late night ...",884.0,204.0,today,"Abode Leeds, Leeds",https://media.rightmove.co.uk:443/dir/crop/10:9-16:9/194k/193922/128324942/193922_31041507_IMG_00_0000_max_476x317.jpeg,2,house,"('53.8088644', '-1.585692')",53.8088644,-1.585692,,2046,+52%,52.0,orange
2 bedroom house,https://www.rightmove.co.uk/properties/128536589#/?channel=STU_LET,"Royal Park Avenue, Leeds, West Yorkshire","**STUDENT PROPERTY or PROFESSIONALS**
**UNIPOL GOLD** **UNLIMITED BILLS INCLUDED**
.
Hyde Park is the hub of student life in Leeds. It is a vibrant, enjoyable place to live that comes to life during term time. Late night Sainsbury`s trips, summer street BBQs and the `occasional` house party are ...",910.0,210.0,today,"Abode Leeds, Leeds",https://media.rightmove.co.uk:443/dir/crop/10:9-16:9/194k/193922/128324534/193922_31890934_IMG_00_0000_max_476x317.jpeg,2,house,"('53.8109573', '-1.5661806')",53.8109573,-1.5661806,,2046,+52%,52.0,orange
4 bedroom house,https://www.rightmove.co.uk/properties/128536589#/?channel=STU_LET,"Royal Park Grove, Leeds, West Workshire","**STUDENT PROPERTY**
**BILLS INCLUSIVE PACKAGES AVAILABLE**
**UNIPOL GOLD** Hyde Park is the hub of student life in Leeds. It is a vibrant, enjoyable place to live that comes to life during term time. Late night Sainsbury`s trips, summer street BBQs and the `occasional` house party are sure to b...",1768.0,408.0,today,"Abode Leeds, Leeds",https://media.rightmove.co.uk:443/dir/crop/10:9-16:9/194k/193922/128324543/193922_31041112_IMG_00_0000_max_476x317.jpeg,4,house,"('53.7974185', '-1.5437941')",53.7974185,-1.5437941,,2046,+52%,52.0,orange
1 bedroom flat,https://www.rightmove.co.uk/properties/128324561#/?channel=STU_LET,"Royal Park Terrace, Leeds, West Yorkshire","**STUDENT PROPERTY**
**BILLS INCLUSIVE PACKAGES AVAILABLE**
**UNIPOL GOLD** Hyde Park is the hub of student life in Leeds. It is a vibrant, enjoyable place to live that comes to life during term time. Late night Sainsbury`s trips, summer street BBQs and the `occasional` house party are sure to b...",507.0,117.0,today,"Abode Leeds, Leeds",https://media.rightmove.co.uk:443/dir/crop/10:9-16:9/194k/193922/128325086/193922_31890967_IMG_00_0000_max_476x317.jpeg,1,flat,"('53.8108992', '-1.5657115')",53.8108992,-1.5657115,,2046,+52%,52.0,orange
4 bedroom house,https://www.rightmove.co.uk/properties/128324561#/?channel=STU_LET,"Brudenell Street, Leeds, West Yorkshire","**STUDENT PROPERTY**
**NO DEPOSIT**
**BILLS INCLUSIVE PACKAGES AVAILABLE**
**UNIPOL GOLD** Hyde Park is the hub of student life in Leeds. It is a vibrant, enjoyable place to live that comes to life during term time. Late night Sainsbury`s trips, summer street BBQs and the `occasional` house part...",1803.0,416.0,today,"Abode Leeds, Leeds",https://media.rightmove.co.uk:443/dir/crop/10:9-16:9/194k/193922/128534063/193922_31906602_IMG_00_0000_max_476x317.jpeg,4,house,"('53.8111445', '-1.5677723')",53.8111445,-1.5677723,,2046,+52%,52.0,orange
1 bedroom flat,https://www.rightmove.co.uk/properties/128324732#/?channel=STU_LET,"Kelso Road, Leeds, West Yorkshire","**STUDENT PROPERTY**
**BILLS INCLUSIVE PACKAGES AVAILABLE**
**UNIPOL GOLD** *Excuse the mess in the photos!* Hyde Park is the hub of student life in Leeds. It is a vibrant, enjoyable place to live that comes to life during term time. Late night Sainsbury`s trips, summer street BBQs and the `occ...",637.0,147.0,today,"Abode Leeds, Leeds",https://media.rightmove.co.uk:443/dir/crop/10:9-16:9/194k/193922/128324897/193922_31041643_IMG_00_0000_max_476x317.jpeg,1,flat,"('53.8062684', '-1.5633033')",53.8062684,-1.5633033,,2046,+52%,52.0,orange
Studio flat,https://www.rightmove.co.uk/properties/128324732#/?channel=STU_LET,"Elegance Studio, Iconinc, The  Glassworks Cardigan Road, Hyde Park","High-spec studio perfectly designed with student living in mind with all the luxury and added extras of a boutique hotel, from the flat screen TV and contemporary en-suite to the plush king size bed and designer fitted kitchen. IconInc offers much more than just a great place...",1143.0,264.0,today,"Parklane, Headingley",https://media.rightmove.co.uk:443/dir/crop/10:9-16:9/122k/121630/128532842/121630_1216303997_IMG_00_0000_max_476x317.jpeg,studio,flat,"('53.7974185', '-1.5437941')",53.7974185,-1.5437941,,2046,+52%,52.0,orange
Studio flat,https://www.rightmove.co.uk/properties/128324942#/?channel=STU_LET,"Elegance Studio, Iconinc, The  Glassworks Cardigan Road, Hyde Park","High-spec studio perfectly designed with student living in mind with all the luxury and added extras of a boutique hotel, from the flat screen TV and contemporary en-suite to the plush king size bed and designer fitted kitchen. IconInc offers much more than just a great place...",1121.0,259.0,today,"Parklane, Headingley",https://media.rightmove.co.uk:443/dir/crop/10:9-16:9/122k/121630/128532827/121630_1216303996_IMG_00_0000_max_476x317.jpeg,studio,flat,"('53.7974185', '-1.5437941')",53.7974185,-1.5437941,,2046,+52%,52.0,orange
Studio flat,https://www.rightmove.co.uk/properties/128324942#/?channel=STU_LET,"Elegance Studio, Iconinc, The  Glassworks Cardigan Road, Hyde Park","High-spec studio perfectly designed with student living in mind with all the luxury and added extras of a boutique hotel, from the flat screen TV and contemporary en-suite to the plush king size bed and designer fitted kitchen. IconInc offers much more than just a great place...",1138.0,263.0,today,"Parklane, Headingley",https://media.rightmove.co.uk:443/dir/crop/10:9-16:9/122k/121630/128532863/121630_1216303998_IMG_00_0000_max_476x317.jpeg,studio,flat,"('53.7974185', '-1.5437941')",53.7974185,-1.5437941,,2046,+52%,52.0,orange
Studio flat,https://www.rightmove.co.uk/properties/128324534#/?channel=STU_LET,"Smart Studio, Iconinc, Glassworks Cardigan Road, Hyde Park","Perfectly designed with student living in mind, offering a unique studio space that is ideal for studying and relaxing. Complete with double bed, large flat screen TV, kitchen, desk and en-suite, you can relax knowing that all bills are included in the rent. IconI...",921.0,213.0,today,"Parklane, Headingley",https://media.rightmove.co.uk:443/dir/crop/10:9-16:9/122k/121630/128532713/121630_1216303995_IMG_00_0000_max_476x317.jpeg,studio,flat,"('53.7974185', '-1.5437941')",53.7974185,-1.5437941,,2046,+52%,52.0,orange
Studio flat,https://www.rightmove.co.uk/properties/128324534#/?channel=STU_LET,"Smart Studio, Iconinc, Glassworks Cardigan Road, Hyde Park","Perfectly designed with student living in mind, offering a unique studio space that is ideal for studying and relaxing. Complete with double bed, large flat screen TV, kitchen, desk and en-suite, you can relax knowing that all bills are included in the rent. IconI...",921.0,213.0,today,"Parklane, Headingley",https://media.rightmove.co.uk:443/dir/crop/10:9-16:9/122k/121630/128532686/121630_1216303993_IMG_00_0000_max_476x317.jpeg,studio,flat,"('53.7974185', '-1.5437941')",53.7974185,-1.5437941,,2046,+52%,52.0,orange
Studio flat,https://www.rightmove.co.uk/properties/128324543#/?channel=STU_LET,"Smart Studio, Iconinc, Glassworks Cardigan Road, Hyde Park","Perfectly designed with student living in mind, offering a unique studio space that is ideal for studying and relaxing. Complete with double bed, large flat screen TV, kitchen, desk and en-suite, you can relax knowing that all bills are included in the rent. IconI...",943.0,218.0,today,"Parklane, Headingley",https://media.rightmove.co.uk:443/dir/crop/10:9-16:9/122k/121630/128532698/121630_1216303994_IMG_00_0000_max_476x317.jpeg,studio,flat,"('53.7974185', '-1.5437941')",53.7974185,-1.5437941,,2046,+52%,52.0,orange
6 bedroom terraced house,https://www.rightmove.co.uk/properties/128324543#/?channel=STU_LET,"Royal Park Avenue, Hyde Leeds, LS6","Available 1st July 2023. £145pppw including bills gas, electric, water and internet. 6 bedrooms. 6 en-suite bathrooms. TV in all bedrooms and lounge. Refurbished to a high standard. Fully furnished. Modern appliances included. Located in central Hyde Park close to the Leeds University. You m...",628.0,145.0,today,"Provision Properties, Leeds",https://media.rightmove.co.uk:443/dir/crop/10:9-16:9/148k/147863/128532509/147863_10031_499_EAF_103632_IMG_00_0000_max_476x317.jpeg,6,house,"('53.8109573', '-1.5661806')",53.8109573,-1.5661806,,2046,+52%,52.0,orange
8 bedroom terraced house,https://www.rightmove.co.uk/properties/128325086#/?channel=STU_LET,"Manor Drive, Hyde Park, Leeds, LS6","Available 8th July 2023. £138pppw bills included gas, electric, water and internet. Provision Properties are pleased to offer this stunning 8 bedroom house in a brilliant location. This property benefits from a large stylish lounge with laminate flooring, comfy leather sofas, coffee table an...",598.0,138.0,today,"Provision Properties, Leeds",https://media.rightmove.co.uk:443/dir/crop/10:9-16:9/148k/147863/128532497/147863_10031_163_EAF_103633_IMG_00_0000_max_476x317.jpeg,8,house,"('53.8157767', '-1.5734303')",53.8157767,-1.5734303,,2046,+52%,52.0,orange
5 bedroom house,https://www.rightmove.co.uk/properties/128325086#/?channel=STU_LET,"St Anne`s Road, Leeds, West Yorkshire","**STUDENT PROPERTY**
**UNIPOL GOLD**
**BILLS INCLUSIVE PACKAGES AVAILABLE** Headingley is an ideal and popular location for students in Leeds. As the home of Rugby League and Leeds Varsity, this area certainly does not disappoint when it comes to being a student. Living in this area, you can exp...",2037.0,470.0,today,"Abode Leeds, Leeds",https://media.rightmove.co.uk:443/dir/crop/10:9-16:9/194k/193922/128325134/193922_30110784_IMG_00_0000_max_476x317.jpeg,5,house,"('53.8226432', '-1.5821374')",53.8226432,-1.5821374,,2046,+52%,52.0,orange
6 bedroom house,https://www.rightmove.co.uk/properties/128534063#/?channel=STU_LET,"Royal Park Avenue, Leeds, West Yorkshire","**STUDENT PROPERTY**
**NO DEPOSIT**
**BILLS INCLUSIVE PACKAGES AVAILABLE**
**UNIPOL GOLD** Hyde Park is the hub of student life in Leeds. It is a vibrant, enjoyable place to live that comes to life during term time. Late night Sainsbury`s trips, summer street BBQs and the `occasional` house par...",2704.0,624.0,today,"Abode Leeds, Leeds",https://media.rightmove.co.uk:443/dir/crop/10:9-16:9/194k/193922/128324366/193922_30584394_IMG_00_0000_max_476x317.jpeg,6,house,"('53.8109573', '-1.5661806')",53.8109573,-1.5661806,,2046,+52%,52.0,orange
1 bedroom flat,https://www.rightmove.co.uk/properties/128534063#/?channel=STU_LET,"- Hyde Park Road, Leeds, West Yorkshire","**STUDENT PROPERTY**
**BILLS INCLUSIVE PACKAGES AVAILABLE**
**UNIPOL GOLD** Hyde Park is the hub of student life in Leeds. It is a vibrant, enjoyable place to live that comes to life during term time. Late night Sainsbury`s trips, summer street BBQs and the `occasional` house party are sure to b...",667.0,154.0,today,"Abode Leeds, Leeds",https://media.rightmove.co.uk:443/dir/crop/10:9-16:9/194k/193922/128325125/193922_31041659_IMG_00_0000_max_476x317.jpeg,1,flat,"('53.8119303', '-1.5642562')",53.8119303,-1.5642562,,2046,+52%,52.0,orange
1 bedroom flat,https://www.rightmove.co.uk/properties/128324897#/?channel=STU_LET,"- Hyde Park Road, Leeds, West Yorkshire","**STUDENT PROPERTY**
**BILLS INCLUSIVE PACKAGES AVAILABLE**
**UNIPOL GOLD** Hyde Park is the hub of student life in Leeds. It is a vibrant, enjoyable place to live that comes to life during term time. Late night Sainsbury`s trips, summer street BBQs and the `occasional` house party are sure to b...",667.0,154.0,today,"Abode Leeds, Leeds",https://media.rightmove.co.uk:443/dir/crop/10:9-16:9/194k/193922/128325122/193922_31041667_IMG_00_0000_max_476x317.jpeg,1,flat,"('53.8119303', '-1.5642562')",53.8119303,-1.5642562,,2046,+52%,52.0,orange
6 bedroom terraced house,https://www.rightmove.co.uk/properties/128352788#/?channel=STU_LET,"Beechwood Terrace, Burley, Leeds LS4 2NG","Available 1st July 2023 This property is an exceptionally large 6 bedroom, 4 bathroom house. Having recently undergone a whole house renovation, the property now boasts an ample open-plan living space, 6 large double bedrooms, 2 family bathrooms and 2 en-suites. This property is in a great loc...",3000.0,692.0,24/10/2022,"Avtar Properties, Leeds",https://media.rightmove.co.uk:443/dir/crop/10:9-16:9/87k/86803/128352788/86803_388568_IMG_00_0000_max_476x317.jpeg,6,house,"('53.8120414', '-1.580503')",53.8120414,-1.580503,,2046,+52%,52.0,orange
1 bedroom apartment,https://www.rightmove.co.uk/properties/128352788#/?channel=STU_LET,"St Johns Terrace, Hyde Park, Leeds, LS3 1DY",DELUXE BILLS PACKAGE. Take advantage of this fantastic one bedroom apartment today. Located in an extremely popular location within walking distance of the university! You will not be disappointed. Offered fully furnished you can move straight into this home!,1020.0,235.0,today,"Sugarhouse Properties, Leeds",https://media.rightmove.co.uk:443/dir/crop/10:9-16:9/77k/76942/128528492/76942_31906269_IMG_00_0000_max_476x317.jpeg,1,apartment,"('53.7974185', '-1.5437941')",53.7974185,-1.5437941,,2046,+52%,52.0,orange
2 bedroom terraced house,https://www.rightmove.co.uk/properties/128528492#/?channel=STU_LET,"Thornville Street, Leeds","***£125 pp/pw, 2 Bed, 2 Bath, Available 1st July 2023***
Beautiful two bedroom, two bathroom property situated within walking distance to the University of Leeds.
   ",1083.0,250.0,today,"HOP, Leeds",https://media.rightmove.co.uk:443/dir/crop/10:9-16:9/152k/151778/128528201/151778_10260578_IMG_00_0000_max_476x317.jpeg,2,house,"('53.8094276', '-1.5719107')",53.8094276,-1.5719107,,2046,+52%,52.0,orange
1 bedroom apartment,https://www.rightmove.co.uk/properties/128528492#/?channel=STU_LET,"St Johns Terrace, Hyde Park, Leeds, LS3 1DY","DELUXE BILLS PACKAGE! Take advantage of this fantastic one bedroom apartment today, located in an extremely popular location within walking distance of the university! You will not be disappointed!",1020.0,235.0,today,"Sugarhouse Properties, Leeds",https://media.rightmove.co.uk:443/dir/crop/10:9-16:9/77k/76942/128527253/76942_31906191_IMG_00_0000_max_476x317.jpeg,1,apartment,"('53.7974185', '-1.5437941')",53.7974185,-1.5437941,,2046,+52%,52.0,orange
1 bedroom apartment,https://www.rightmove.co.uk/properties/128528201#/?channel=STU_LET,"St Johns Terrace, Hyde Park, Leeds, LS3 1DY","DELUXE BILLS PACKAGE. Take advantage of this fantastic studio apartment today, located in an extremely popular location within walking distance of the university! You will not be disappointed, offered fully furnished you can move straight into this home!",1020.0,235.0,today,"Sugarhouse Properties, Leeds",https://media.rightmove.co.uk:443/dir/crop/10:9-16:9/77k/76942/128527214/76942_31906186_IMG_00_0000_max_476x317.jpeg,1,apartment,"('53.7974185', '-1.5437941')",53.7974185,-1.5437941,,2046,+52%,52.0,orange
1 bedroom apartment,https://www.rightmove.co.uk/properties/128528201#/?channel=STU_LET,"Richmond Road, Hyde Park, Leeds, LS6 1BX","Lovely open plan apartment with modern decor and fixtures throughout in this very popular location - close to Hyde Park Corner and not too far to stroll into central Headingley, the best of both worlds!!",625.0,144.0,today,"Sugarhouse Properties, Leeds",https://media.rightmove.co.uk:443/dir/crop/10:9-16:9/77k/76942/128527088/76942_31906175_IMG_00_0000_max_476x317.jpeg,1,apartment,"('53.8166159', '-1.5717257')",53.8166159,-1.5717257,,2046,+52%,52.0,orange
1 bedroom apartment,https://www.rightmove.co.uk/properties/128527253#/?channel=STU_LET,"Richmond Road, Hyde Park, Leeds, LS6 1BX",EXCELLENT LOCATION! Cracking one bed flat located in prime location for both universities. Offers a huge amount of space and a modern bathroom and kitchen.,670.0,155.0,today,"Sugarhouse Properties, Leeds",https://media.rightmove.co.uk:443/dir/crop/10:9-16:9/77k/76942/128526878/76942_31906168_IMG_00_0000_max_476x317.jpeg,1,apartment,"('53.8166159', '-1.5717257')",53.8166159,-1.5717257,,2046,+52%,52.0,orange
1 bedroom apartment,https://www.rightmove.co.uk/properties/128527253#/?channel=STU_LET,"Richmond Road, Hyde Park, Leeds, LS6 1BX","Contemporary open plan, one bedroom apartment available in the heart of Hyde Park. Fantastic chance to have your own space within walking distance of both Headingley, Hyde Park and Burley Park station.",675.0,156.0,today,"Sugarhouse Properties, Leeds",https://media.rightmove.co.uk:443/dir/crop/10:9-16:9/77k/76942/128526746/76942_31906150_IMG_00_0000_max_476x317.jpeg,1,apartment,"('53.8166159', '-1.5717257')",53.8166159,-1.5717257,,2046,+52%,52.0,orange
Studio flat,https://www.rightmove.co.uk/properties/128527214#/?channel=STU_LET,"Neo Studio, Iconinc, Glassworks Cardigan Road, Hyde Park","Perfectly designed with student living in mind, offering a unique studio space that is ideal for studying and relaxing. Complete with double bed, large flat screen TV, kitchen, desk and en-suite, you can relax knowing that all bills are included in the rent. IconI...",787.0,182.0,today,"Parklane, Headingley",https://media.rightmove.co.uk:443/dir/crop/10:9-16:9/122k/121630/128526698/121630_1216303990_IMG_00_0000_max_476x317.jpeg,studio,flat,"('53.7974185', '-1.5437941')",53.7974185,-1.5437941,,2046,+52%,52.0,orange
Studio flat,https://www.rightmove.co.uk/properties/128527214#/?channel=STU_LET,"Neo Studio, Iconinc, Glassworks Cardigan Road, Hyde Park","Perfectly designed with student living in mind, offering a unique studio space that is ideal for studying and relaxing. Complete with double bed, large flat screen TV, kitchen, desk and en-suite, you can relax knowing that all bills are included in the rent. IconI...",787.0,182.0,today,"Parklane, Headingley",https://media.rightmove.co.uk:443/dir/crop/10:9-16:9/122k/121630/128526725/121630_1216303991_IMG_00_0000_max_476x317.jpeg,studio,flat,"('53.7974185', '-1.5437941')",53.7974185,-1.5437941,,2046,+52%,52.0,orange
Studio flat,https://www.rightmove.co.uk/properties/128527088#/?channel=STU_LET,"Neo Studio, Iconinc, Glassworks Cardigan Road, Hyde Park","Perfectly designed with student living in mind, offering a unique studio space that is ideal for studying and relaxing. Complete with double bed, large flat screen TV, kitchen, desk and en-suite, you can relax knowing that all bills are included in the rent. IconI...",787.0,182.0,today,"Parklane, Headingley",https://media.rightmove.co.uk:443/dir/crop/10:9-16:9/122k/121630/128526743/121630_1216303992_IMG_00_0000_max_476x317.jpeg,studio,flat,"('53.7974185', '-1.5437941')",53.7974185,-1.5437941,,2046,+52%,52.0,orange
1 bedroom apartment,https://www.rightmove.co.uk/properties/128527088#/?channel=STU_LET,"Grimthorpe Street, Headingley, Leeds, LS6 3JU","Lovely modern flat with oak laminate flooring throughout. Located within central Headingley, close to shops, pubs, restaurants and Leeds Met Becketts Park campus. The property offers a spacious double bedroom, large dining lounge with modern high gloss kitchen, complete with fully tiled bathroom.",805.0,186.0,today,"Sugarhouse Properties, Leeds",https://media.rightmove.co.uk:443/dir/crop/10:9-16:9/77k/76942/128526374/76942_31906125_IMG_00_0000_max_476x317.jpeg,1,apartment,"('53.8217515', '-1.5838696')",53.8217515,-1.5838696,,2046,+52%,52.0,orange
3 bedroom house,https://www.rightmove.co.uk/properties/128526878#/?channel=STU_LET,"Willow Close, Leeds, West Yorkshire","**STUDENT PROPERTY or PROFESSIONALS**
**BILLS INCLUSIVE PACKAGE +£26PPW)
**UNIPOL GOLD** Hyde Park is the hub of student life in Leeds. It is a vibrant, enjoyable place to live that comes to life during term time. Late night Sainsbury`s trips, summer street BBQs and the `occasional` house party...",1755.0,405.0,today,"Abode Leeds, Leeds",https://media.rightmove.co.uk:443/dir/crop/10:9-16:9/194k/193922/128325359/193922_31327840_IMG_00_0000_max_476x317.jpeg,3,house,"('53.877354', '-1.7106549')",53.877354,-1.7106549,,2046,+52%,52.0,orange
5 bedroom terraced house,https://www.rightmove.co.uk/properties/128526878#/?channel=STU_LET,"Newport View, Leeds, LS6 - Good Transport Links",AVAILABLE JULY 2023 - RENT - £95 PPPW-This stunning five bedroom house is ideal for students. With its own private garden and spacious bedrooms throughout. Fully furnished living room with large windows allowing in plenty of natural light to brighten up the property.,2058.0,475.0,today,"Big Blue Lettings, Leeds",https://media.rightmove.co.uk:443/dir/crop/10:9-16:9/143k/142634/87109973/142634_38NV_IMG_00_0000_max_476x317.jpg,5,house,"('53.7974185', '-1.5437941')",53.7974185,-1.5437941,,2046,+52%,52.0,orange
