title,link,address,description,price,sq_ft,date,seller,image,bed,type,lat_lon,lat,lon,nres
16 bedroom mixed use for sale,https://www.rightmove.co.uk/properties/127922603#/?channel=COM_BUY,"Easterly Road, Leeds, West Yorkshire, LS8","Mixed use property consisting of 4 well let commercial units at ground floor level, 16 one-bedroom self-contained apartments at first floor level and extensive car parking at front and rear. ",1500000.0,12000,,"Malcolm Stuart Property Consultants LLP, Tadcaster",https://media.rightmove.co.uk:443/dir/crop/10:9-16:9/141k/140816/127922603/140816_230240E_IMG_02_0000_max_476x317.jpeg,16,sale,"('53.8005568', '-1.5630613')",53.8005568,-1.5630613,168
Residential development for sale,https://www.rightmove.co.uk/properties/127922603#/?channel=COM_BUY,"Boston Exchange & 83 Cardigan Lane, Boston Exchange, Leeds, LS4 2AJ",Newly Constructed and Income Producing Residential Investments in Leeds,9400000.0,1498,,"BNP PARIBAS REAL ESTATE ADVISORY & PROPERTY MANAGEMENT UK LIMITED, Sheffield",https://media.rightmove.co.uk:443/dir/crop/10:9-16:9/209k/208589/114718766/208589_69792-1_IMG_01_0000_max_476x317.jpeg,nan,sale,"('53.8005568', '-1.5630613')",53.8005568,-1.5630613,168
Land for sale,https://www.rightmove.co.uk/properties/114718766#/?channel=COM_BUY,"Bow Street, Leeds",Residential Development Opportunity in Prime Location in Leeds,,94525,,"Savills, Leeds",https://media.rightmove.co.uk:443/dir/crop/10:9-16:9/74k/73113/123658481/73113_04F0E085-F70D-4C3D-9F12-D8A6ACD5B7CC_IMG_00_0002_max_476x317.jpeg,nan,sale,"('53.8005568', '-1.5630613')",53.8005568,-1.5630613,168
Light industrial for sale,https://www.rightmove.co.uk/properties/114718766#/?channel=COM_BUY,"Units 1, 2 & 3 Rudgate Business Centre, Wetherby, YO26 7RD","The premises comprise 3 interlinking warehouse buildings providing large open plan warehousing with integrated retrofitted office and amenity block facilities.The warehouse accommodation has off road parking and is further serviced via a secure fence and service yard, again off the Rudgate frontage.",2350000.0,33171,,"Lawrence Hannah, York",https://media.rightmove.co.uk:443/dir/crop/10:9-16:9/127k/126439/91637888/126439_Units_1_2_3_Rudgate_IMG_01_0000_max_476x317.JPG,nan,sale,"('53.8005568', '-1.5630613')",53.8005568,-1.5630613,168
Office for sale,https://www.rightmove.co.uk/properties/123658481#/?channel=COM_BUY,"Elmete Hall Elmete Lane, Leeds, West Yorkshire, LS8 2LJ","Elmete Hall dates back to 1815 and was one of the finest grade II listed country houses in Leeds, built by the Nicholson family and sold to James Kitson the famous Leeds Engineer. More recently the building was extensively redeveloped and extended in 2005 to provide high quality office buildings...",,12722,,"Lambert Smith Hampton, Leeds",https://media.rightmove.co.uk:443/dir/crop/10:9-16:9/170k/169838/83981369/169838_2039221FH_IMG_01_0000_max_476x317.jpg,nan,sale,"('53.8005568', '-1.5630613')",53.8005568,-1.5630613,168
Shop for sale,https://www.rightmove.co.uk/properties/123658481#/?channel=COM_BUY,"Butchers, Yorkshire, Yorkshire","WHOLESALE CATERING BUTCHERS Adjusted Net Profits in Excess of £500,000
Retirement Sale After 24 Years Here
The Sale Includes a Fleet of Vehicles and Equipment
RARELY DO BUSINESSES OF THIS CALIBRE REACH THE OPEN MARKET
Annual Turnover £5,858,610
REF 557463. EPC Band E.
Business £1,750,000
Yorkshire",1750000.0,,,"Ernest Wilson & Co Limited, EW Leeds",https://media.rightmove.co.uk:443/dir/crop/10:9-16:9/154k/153122/123466490/153122_557463_IMG_00_0001_max_476x317.jpeg,nan,sale,"('53.8005568', '-1.5630613')",53.8005568,-1.5630613,168
16 bedroom mixed use for sale,https://www.rightmove.co.uk/properties/91637888#/?channel=COM_BUY,"Easterly Road, Leeds, West Yorkshire, LS8","Mixed use property consisting of 4 well let commercial units at ground floor level, 16 one-bedroom self-contained apartments at first floor level and extensive car parking at front and rear. ",1500000.0,12000,,"Malcolm Stuart Property Consultants LLP, Tadcaster",https://media.rightmove.co.uk:443/dir/crop/10:9-16:9/141k/140816/127922603/140816_230240E_IMG_02_0000_max_476x317.jpeg,16,sale,"('53.8005568', '-1.5630613')",53.8005568,-1.5630613,168
Commercial property for sale,https://www.rightmove.co.uk/properties/91637888#/?channel=COM_BUY,"37 - 41 Kirkgate, Otley, West Yorkshire, LS21 3HN","Retail investment and superb residential development opportunity.
Rare Grade II Listed freehold opportunity.
Residential potential for 13/14 apartments.
Two retail units included producing £31,250 per annum.
Superb location within Otley town centre.",,15975,,"Eddisons Commercial Limited, Bradford",https://media.rightmove.co.uk:443/dir/crop/10:9-16:9/237k/236918/107095529/236918_3004026FH_IMG_00_0000_max_476x317.jpeg,nan,sale,"('53.8005568', '-1.5630613')",53.8005568,-1.5630613,168
Warehouse for sale,https://www.rightmove.co.uk/properties/83981369#/?channel=COM_BUY,"Troy Works, Bradford Road, Stanningley, Pudsey, West Yorkshire, LS28 6QA","Industrial complex with ancillary offices. Rare freehold opportunity.
Site area of 0.8 acre.
Large power supply.",1400000.0,23310,,"Eddisons Commercial Limited, Bradford",https://media.rightmove.co.uk:443/dir/crop/10:9-16:9/237k/236918/85600602/236918_3005815FH_IMG_01_0000_max_476x317.jpeg,nan,sale,"('53.8005568', '-1.5630613')",53.8005568,-1.5630613,168
Distribution warehouse for sale,https://www.rightmove.co.uk/properties/83981369#/?channel=COM_BUY,"Unit 16, Astley Way Industrial Estate, Swillington, Leeds, LS26 8XT","For Sale - Detached Modem Warehouse unit of 11,342 sq ft Asking Price £1250000.00  Unit 16 comprises a modern detached warehouse / industrial unit of steel portal frame construction with two storey offices to the front elevation. 
 
The unit benefits from 3 electric ground level...",1250000.0,11324,,"Knight Frank, Leeds - Commercial",https://media.rightmove.co.uk:443/dir/crop/10:9-16:9/156k/155510/126845399/155510_LDL012085896_IMG_00_0000_max_476x317.jpeg,nan,sale,"('53.8005568', '-1.5630613')",53.8005568,-1.5630613,168
Shop for sale,https://www.rightmove.co.uk/properties/123466490#/?channel=COM_BUY,"Electrical, North of England, North of England","ELECTRICAL CONTRACTORS Operated Throughout the United Kingdom
Adjusted Net Profits in Excess of £408,000
Electrical Installation Services Primarily on Large Projects and Developments
Forward Order Book Taking it to Circa 15 Months
Annual Turnover £1.8 to £2 Million
REF 586802. Business, Offers...",1250000.0,,,"Ernest Wilson & Co Limited, EW Leeds",,nan,sale,"('53.8005568', '-1.5630613')",53.8005568,-1.5630613,168
Bar / nightclub for sale,https://www.rightmove.co.uk/properties/123466490#/?channel=COM_BUY,"Lowtown, Pudsey, West Yorkshire, LS28",Bojangles is a well-established popular bar in the busy suburb of LeedsEstablished in 2004 this is a much-loved bar at the heart of the Pudsey's late-night sceneBojangles is the largest venue in Pudsey for live music events and private hire,1000000.0,,,"Nationwide Business Sales LTD, Castleford",https://media.rightmove.co.uk:443/dir/crop/10:9-16:9/241k/240671/124485362/240671_bojangles_IMG_02_0000_max_476x317.jpeg,nan,sale,"('53.8005568', '-1.5630613')",53.8005568,-1.5630613,168
Warehouse for sale,https://www.rightmove.co.uk/properties/127922603#/?channel=COM_BUY,"Montrose Works, Bradford Road, Stanningley, Pudsey, West Yorkshire, LS28 6QA","Industrial unit with offices and yard. Rare freehold opportunity.
Car parking/secure yard area. Single storey industrial/warehouse unit.",860000.0,11445,,"Eddisons Commercial Limited, Bradford",https://media.rightmove.co.uk:443/dir/crop/10:9-16:9/237k/236918/85600275/236918_3005814FH_IMG_01_0000_max_476x317.jpeg,nan,sale,"('53.8005568', '-1.5630613')",53.8005568,-1.5630613,168
Garage for sale,https://www.rightmove.co.uk/properties/127922603#/?channel=COM_BUY,"Princess Garage, Chapel Street, Leeds, West Yorkshire, LS6","BUSINESS AND FREEHOLD PROPERTY FOR SALE! Very Well-known Established Car Service & Repairs/ MOT Garage £845,000. Run from a large commercial garage unit, with circa 1,600 square ft. of useable floor space. Substantial takings & profits achieved. Request full details, early inspection recommended. ",845000.0,,,"Alan J Picken, Ilkley",https://media.rightmove.co.uk:443/dir/crop/10:9-16:9/231k/230060/125515463/230060_RM10419_IMG_02_0000_max_476x317.jpeg,nan,sale,"('53.8005568', '-1.5630613')",53.8005568,-1.5630613,168
Light industrial for sale,https://www.rightmove.co.uk/properties/107095529#/?channel=COM_BUY,"Cloverleaf House, 18 Brown Lane West, Leeds, West Yorkshire, LS11 0DN","The building comprises versatile accommodation, most recently occupied as a children's nursery and previously a warehouse with showroom. In brief, the property benefits from the following features; - Ground level loading
- Mixture of office accommodation
- 3 phase power
- Heating and lighting t...",650000.0,9415,,"Dove Haigh Phillips LLP, Leeds",https://media.rightmove.co.uk:443/dir/crop/10:9-16:9/59k/58716/123947078/58716_338FH_IMG_00_0000_max_476x317.jpeg,nan,sale,"('53.8005568', '-1.5630613')",53.8005568,-1.5630613,168
Commercial property for sale,https://www.rightmove.co.uk/properties/107095529#/?channel=COM_BUY,"Pest Control, West Yorkshire, West Yorkshire","PEST CONTROL BUSINESS FOR SALE
Specialising in Bird Prevention at Height
Providing General Maintenance Associated with Birds and Other Pests
Adjusted Net Profits of Almost £300,000
Excellent Client Base with Several Multi-Site and Blue Chip Clients
Annual Turnover £546,159
REF 587266. Business,...",625000.0,,,"Ernest Wilson & Co Limited, EW Leeds",https://media.rightmove.co.uk:443/dir/crop/10:9-16:9/154k/153122/123131228/153122_587266_IMG_00_0002_max_476x317.jpeg,nan,sale,"('53.8005568', '-1.5630613')",53.8005568,-1.5630613,168
Restaurant for sale,https://www.rightmove.co.uk/properties/85600602#/?channel=COM_BUY,"Dock Street, Leeds, West Yorkshire, LS10","For Sale - Long Leasehold Restaurant Investment (2,533 sqft) on a 20 year term from 23rd June 2018.well located in the Brewery Wharf and Victoria Quays district of the City within walking distance from Leeds Train and Bus Station. ",575000.0,2533,,"HARVEY BURNS & CO. LIMITED, Leeds",https://media.rightmove.co.uk:443/dir/crop/10:9-16:9/241k/240254/123296591/240254_Ciaobella_IMG_00_0000_max_476x317.jpeg,nan,sale,"('53.8005568', '-1.5630613')",53.8005568,-1.5630613,168
Residential development for sale,https://www.rightmove.co.uk/properties/85600602#/?channel=COM_BUY,"Building/Home Improvement, Online Business, Online Business","HARD SURFACE REPAIR AND RESURFACING BUSINESS
Repairing Sinks, Tiles, Marble and Quartz Worktops, Wooden Floors and Stone Cladding
Employing 21 Field Based Technicians
Working Closely with Builders and Shopfitters etc
Showing Adjusted Net Profits in Excess of £170,000
Annual Turnover £1,166,642
RE...",550000.0,,,"Ernest Wilson & Co Limited, EW Leeds",https://media.rightmove.co.uk:443/dir/crop/10:9-16:9/154k/153122/127079813/153122_588503_IMG_00_0000_max_476x317.png,nan,sale,"('53.8005568', '-1.5630613')",53.8005568,-1.5630613,168
Retail property (high street) for sale,https://www.rightmove.co.uk/properties/126845399#/?channel=COM_BUY,"63-67 Otley Road, Leeds, West Yorkshire, LS6",The subject property lies directly on the main junction of Otley Road and North Lane in the centre of Headingly. It benefits from being in an extremely prominent location and would be suitable for a variety of different uses subject to obtaining the necessary planning consents.,500000.0,3156,,"BARKER PROUDLOVE LIMITED, Leeds",https://media.rightmove.co.uk:443/dir/crop/10:9-16:9/229k/228959/125159213/228959_63_67_Otley_Rd_IMG_00_0000_max_476x317.jpeg,nan,sale,"('53.8005568', '-1.5630613')",53.8005568,-1.5630613,168
Commercial property for sale,https://www.rightmove.co.uk/properties/126845399#/?channel=COM_BUY,"Post Offices, Boston Spa, West Yorkshire","POST OFFICE, CARDS & STATIONERY Prime Trading Position
VIEWING HERE CANNOT BE RECOMMENDED HIGHLY ENOUGH
Three Bedroom Accommodation Post Office Remuneration £66,500
Weekly Retail Sales £600
REF 581657. EPC Band E.
Business & Property, Offers Around £459,950
Leeds",459950.0,,,"Ernest Wilson & Co Limited, EW Leeds",https://media.rightmove.co.uk:443/dir/crop/10:9-16:9/154k/153122/64983928/153122_581657_IMG_00_0000_max_476x317.jpeg,nan,sale,"('53.8005568', '-1.5630613')",53.8005568,-1.5630613,168
Leisure facility for sale,https://www.rightmove.co.uk/properties/85599069#/?channel=COM_BUY,"32 - 33 Kirkgate, Leeds, West Yorkshire, LS2 7DR","Prominent Retail/Leisure Unit.
Prominently retail/leisure unit located within the city centre.
Within walking distance of the Bus Station/Briggate.
Close proximity to new Victoria Gate development.
Of interest to retail/leisure occupiers.",400000.0,2840,,"Eddisons Commercial Limited, Bradford",https://media.rightmove.co.uk:443/dir/crop/10:9-16:9/237k/236918/107095757/236918_3004323FH_IMG_00_0000_max_476x317.jpeg,nan,sale,"('53.8005568', '-1.5630613')",53.8005568,-1.5630613,168
Light industrial for sale,https://www.rightmove.co.uk/properties/85599069#/?channel=COM_BUY,"Manufacturing, North of England, North of England","MANUFACTURER OF MODEL RAILWAYS
Showing Net Profits Adjusted in Excess of £150,000
Old established business
Spacious engineering works
Impressive range of engineering equipment
Annual Turnover £1.2 Million
REF 587305
Business £400,000
North of England",400000.0,,,"Ernest Wilson & Co Limited, EW Leeds",https://media.rightmove.co.uk:443/dir/crop/10:9-16:9/154k/153122/123698138/153122_587305_IMG_00_0001_max_476x317.jpeg,nan,sale,"('53.8005568', '-1.5630613')",53.8005568,-1.5630613,168
4 bedroom retail property (out of town) for sale,https://www.rightmove.co.uk/properties/124485362#/?channel=COM_BUY,"Otley Road, Leeds, West Yorkshire, LS16",275 OTLEY ROADLEEDSLS16 5LN FREEHOLD VACANT SHOP & FLAT ,400000.0,551,,"Tapp Chartered Surveyors, Leeds",https://media.rightmove.co.uk:443/dir/crop/10:9-16:9/79k/78372/84017403/78372_275OR_IMG_00_0000_max_476x317.jpeg,4,sale,"('53.8005568', '-1.5630613')",53.8005568,-1.5630613,168
Retail property (high street) for sale,https://www.rightmove.co.uk/properties/124485362#/?channel=COM_BUY,"32 Town Street, Horsforth, Leeds","The property comprises a modern two-storey retail unit. It provides an open plan area at ground floor that has been divided up to provide a banking hall, several offices and strong room, whilst at first floor there is a large office, staff room, stores (potential further offices) and toilets.",400000.0,2238,,"Walker Singleton (Commercial), Leeds",https://media.rightmove.co.uk:443/dir/crop/10:9-16:9/212k/211115/123575990/211115_103463_IMG_00_0000_max_476x317.jpeg,nan,sale,"('53.8005568', '-1.5630613')",53.8005568,-1.5630613,168
Restaurant for sale,https://www.rightmove.co.uk/properties/85600275#/?channel=COM_BUY,Leeds,"Long standing restaurant in good decorative order throughout, been trading over ten years.Open 7 days a week from 11.30amHighly profitable.Turnover in excess of £1,300,000 per annumThe business premise is held on a lease and will be assigned to the new business owner.",375000.0,,,"Parker Barras, Leeds",https://media.rightmove.co.uk:443/dir/crop/10:9-16:9/82k/81615/124665629/81615_Business_IMG_00_0000_max_476x317.jpeg,nan,sale,"('53.8005568', '-1.5630613')",53.8005568,-1.5630613,168
Bar / nightclub for sale,https://www.rightmove.co.uk/properties/124485362#/?channel=COM_BUY,"Lowtown, Pudsey, West Yorkshire, LS28",Bojangles is a well-established popular bar in the busy suburb of LeedsEstablished in 2004 this is a much-loved bar at the heart of the Pudsey's late-night sceneBojangles is the largest venue in Pudsey for live music events and private hire,1000000.0,,,"Nationwide Business Sales LTD, Castleford",https://media.rightmove.co.uk:443/dir/crop/10:9-16:9/241k/240671/124485362/240671_bojangles_IMG_02_0000_max_476x317.jpeg,nan,sale,"('53.8005568', '-1.5630613')",53.8005568,-1.5630613,168
Restaurant for sale,https://www.rightmove.co.uk/properties/124485362#/?channel=COM_BUY,Leeds,"Long standing restaurant in good decorative order throughout, been trading over ten years.Open 7 days a week from 11.30amHighly profitable.Turnover in excess of £1,300,000 per annumThe business premise is held on a lease and will be assigned to the new business owner.",375000.0,,,"Parker Barras, Leeds",https://media.rightmove.co.uk:443/dir/crop/10:9-16:9/82k/81615/124665629/81615_Business_IMG_00_0000_max_476x317.jpeg,nan,sale,"('53.8005568', '-1.5630613')",53.8005568,-1.5630613,168
Restaurant for sale,https://www.rightmove.co.uk/properties/124665629#/?channel=COM_BUY,"Red Chilli Restaurant, Great George Street, Leeds, West Yorkshire, LS1","BUSINESS FOR SALE- Popular Traditional, Authentic Chinese Restaurant. Premises available on lease, fitted with modern & valuable fixtures, fittings & equipment. Prime trading position in the centre of Leeds, ran from an excellent premises. Full details available on application. ",375000.0,,,"Alan J Picken, Ilkley",https://media.rightmove.co.uk:443/dir/crop/10:9-16:9/231k/230060/123195527/230060_Z10385_IMG_00_0000_max_476x317.jpeg,nan,sale,"('53.8005568', '-1.5630613')",53.8005568,-1.5630613,168
Warehouse for sale,https://www.rightmove.co.uk/properties/124665629#/?channel=COM_BUY,"St Mary's Works, Middleton Road, Morley, Leeds, West Yorkshire, LS27 8AP","Former chapel currently used as a workshop suitable for residential redevelopment.
Situated close to the centre of Morley with good access.",,4414,,"Eddisons Commercial Limited, Leeds",https://media.rightmove.co.uk:443/dir/crop/10:9-16:9/237k/236921/107097230/236921_3001165FH_IMG_00_0000_max_476x317.jpeg,nan,sale,"('53.8005568', '-1.5630613')",53.8005568,-1.5630613,168
Commercial property for sale,https://www.rightmove.co.uk/properties/123195527#/?channel=COM_BUY,"Building/Home Improvement, Morley, West Yorkshire","KITCHEN AND BEDROOM SHOWROOM Showing Approximately £200,000 Adjusted Net Profit
Worked in Very Easy Hours Over Five Days
Retirement Sale After 30 Years Here
VIEW EARLY, THIS WILL GO
Annual Turnover £878,003
REF 586908. EPC Band C.
Business £350,000
Leeds
",350000.0,,,"Ernest Wilson & Co Limited, EW Leeds",https://media.rightmove.co.uk:443/dir/crop/10:9-16:9/154k/153122/115497077/153122_586908_IMG_00_0001_max_476x317.jpeg,nan,sale,"('53.8005568', '-1.5630613')",53.8005568,-1.5630613,168
Commercial property for sale,https://www.rightmove.co.uk/properties/123195527#/?channel=COM_BUY,"Garden Centre & Horticulture, Horsforth, West Yorkshire","GARDEN CENTRE WITH COFFEE SHOP AND FULLY LICENSED BAR
Almost 5 Acres Of Fully Stocked Grounds
Showing Exceptional Net Profits
Popular Coffee Shop With Alcohol Licence
One Of The UK’s Top Independently Owned Centres
Weekly Turnover £20,000
REF 559183. EPC Band D
Business £300,000
Leeds",300000.0,,,"Ernest Wilson & Co Limited, EW Leeds",https://media.rightmove.co.uk:443/dir/crop/10:9-16:9/154k/153122/63047794/153122_559183_IMG_00_0001_max_476x317.jpeg,nan,sale,"('53.8005568', '-1.5630613')",53.8005568,-1.5630613,168
Restaurant for sale,https://www.rightmove.co.uk/properties/107097230#/?channel=COM_BUY,"Hot Food Take Away, West Yorkshire","PROFESSIONAL PIZZA BAR One of the Busiest Sites in West Yorkshire
Retirement Sale After 22 Years Here
Highly Profitable Concern Yet Scope for Much More
THIS IS A TREMENDOUS BUY – VERY MUCH RECOMMENDED
Weekly Turnover £16,000 to £18,000
REF 584891. EPC Band E.
Business £295,000
Leeds",295000.0,,,"Ernest Wilson & Co Limited, EW Leeds",https://media.rightmove.co.uk:443/dir/crop/10:9-16:9/154k/153122/84619678/153122_584891_IMG_00_0000_max_476x317.jpeg,nan,sale,"('53.8005568', '-1.5630613')",53.8005568,-1.5630613,168
Commercial property for sale,https://www.rightmove.co.uk/properties/107097230#/?channel=COM_BUY,"Garden Centre & Horticulture, North of England, North of England","LANDSCAPE ARCHITECTS Providing Services to Clients Throughout the UK
Exceptional Adjusted Net Profits in Excess of £135,000
Offering Traditional Landscape Design and Assessment Services and Ecology Surveys
Run From an Extensive Suite of Offices Which Are Held on Lease
Annual Net Turnover £553,93...",250000.0,,,"Ernest Wilson & Co Limited, EW Leeds",https://media.rightmove.co.uk:443/dir/crop/10:9-16:9/154k/153122/125504003/153122_587167_IMG_00_0001_max_476x317.jpeg,nan,sale,"('53.8005568', '-1.5630613')",53.8005568,-1.5630613,168
Land for sale,https://www.rightmove.co.uk/properties/115497077#/?channel=COM_BUY,"Land at Astley Way, Astley Lane Industrial Estate, Swillington, Leeds","The land is fairly regular in shape and reasonably level, currently overgrown with grass and shrubbery. It is calculated the land extends to a gross area of around 0.219 hectare (0.541 acre). It is considered the land would be suitable for industrial development or the creation of a storage ...",250000.0,23522,,"Walker Singleton (Commercial), Leeds",https://media.rightmove.co.uk:443/dir/crop/10:9-16:9/212k/211115/128647334/211115_103446_IMG_00_0000_max_476x317.jpeg,nan,sale,"('53.8005568', '-1.5630613')",53.8005568,-1.5630613,168
Place of worship for sale,https://www.rightmove.co.uk/properties/115497077#/?channel=COM_BUY,"Church Street, Leeds, West Yorkshire, LS26",Former church,225000.0,2585,,"NABARRO MCALLISTER & CO LIMITED, Leeds",,nan,sale,"('53.8005568', '-1.5630613')",53.8005568,-1.5630613,168
Land for sale,https://www.rightmove.co.uk/properties/63047794#/?channel=COM_BUY,"Development Site, Helston Way, Leeds, LS10 4PG","Freehold. Development site on former pub. 10-12 apartment C3 units previously approved. Recently expired planning permission in 2021. 0.425 acre cleared site. Transport links, retail & amenities close by",225000.0,,,"Christie & Co, Leeds",https://media.rightmove.co.uk:443/dir/crop/10:9-16:9/164k/163163/128511248/163163_5455495-fh_IMG_00_0000_max_476x317.jpeg,nan,sale,"('53.8005568', '-1.5630613')",53.8005568,-1.5630613,168
Plot for sale,https://www.rightmove.co.uk/properties/63047794#/?channel=COM_BUY,"Development Site, Helston Way, Leeds, LS10 4PG","Freehold. Development site on former pub. 10-12 apartment C3 units previously approved. Recently expired planning permission in 2021. 0.425 acre cleared site. Transport links, retail & amenities close by",225000.0,,,"Christie & Co, Leeds",https://media.rightmove.co.uk:443/dir/crop/10:9-16:9/164k/163163/128600354/163163_residevelopment_IMG_00_0000_max_476x317.jpeg,nan,sale,"('53.8005568', '-1.5630613')",53.8005568,-1.5630613,168
Cafe for sale,https://www.rightmove.co.uk/properties/84619678#/?channel=COM_BUY,"Cafe & Sandwich Bars, West yorkshire","SANDWICH BAR
Refurbished to an Exceptionally High Standard
Prime Trading Position
Maintaining Excellent Margins
Run By Staff In Very Easy Hours
Weekly Turnover £3,000
REF 587306 EPC Band D.
Business and Property, Offers Around £215,000
Leeds",215000.0,,,"Ernest Wilson & Co Limited, EW Leeds",https://media.rightmove.co.uk:443/dir/crop/10:9-16:9/154k/153122/123661052/153122_587306_IMG_00_0001_max_476x317.jpeg,nan,sale,"('53.8005568', '-1.5630613')",53.8005568,-1.5630613,168
Garage for sale,https://www.rightmove.co.uk/properties/84619678#/?channel=COM_BUY,"Printing, Publishing & Photography, Rothwell, West Yorkshire","COMMERCIAL VEHICLE LIVERY AND SIGNAGE BUSINESS Over 45 Years in the Same Hands
High Volume of Return Business
Freehold and Leasehold Property Options
Services Provide High Profit Margins
Annual Turnover £150,000 to £178,000
REF 588445. EPC Band E.
Business and Property £200,000
Business Only £9...",200000.0,,,"Ernest Wilson & Co Limited, EW Leeds",https://media.rightmove.co.uk:443/dir/crop/10:9-16:9/154k/153122/125768306/153122_588445_IMG_00_0002_max_476x317.jpeg,nan,sale,"('53.8005568', '-1.5630613')",53.8005568,-1.5630613,168
Commercial property for sale,https://www.rightmove.co.uk/properties/125504003#/?channel=COM_BUY,"Vacant Unit, West Yorkshire","VACANT SHOP UNIT
Excellent and Rare Opportunity
Local Landmark Property
Huge Potential
Easy Roadside Parking
REF 588615
Property, Offers Around £195,000
Leeds",195000.0,,,"Ernest Wilson & Co Limited, EW Leeds",https://media.rightmove.co.uk:443/dir/crop/10:9-16:9/154k/153122/128575064/153122_588615_IMG_00_0001_max_476x317.jpeg,nan,sale,"('53.8005568', '-1.5630613')",53.8005568,-1.5630613,168
Commercial property for sale,https://www.rightmove.co.uk/properties/125504003#/?channel=COM_BUY,"Town Street, Stanningley, Pudsey","The property comprises a part two storey and part three storey mixed commercial and residential property positioned in a prominent main road location. The ground floor is occupied by a hot food takeaway and extends to 426 ft², with the tenant paying £7,200 per annum. Above is a one bedro...",190000.0,,,"BRAMLEYS LLP, Huddersfield",https://media.rightmove.co.uk:443/dir/crop/10:9-16:9/230k/229391/127853204/229391_31851804_IMG_00_0000_max_476x317.jpeg,nan,sale,"('53.8005568', '-1.5630613')",53.8005568,-1.5630613,168
Convenience store for sale,https://www.rightmove.co.uk/properties/128647334#/?channel=COM_BUY,"Off License & Convenience, Meanwood, West Yorkshire","FULLY LICENSED CONVENIENCE STORE Busy Main Road Site in this Densely Populated Residential Area
Sensibly Priced Due to Retirement
Professionally Fitted Store
VIEW EARLY, THIS WILL GO. HIGHLY RECOMMENDED
Weekly Turnover £18,000 to £19,000 Annual Lottery Commission of £7,500
REF 587398. Busine...",179950.0,,,"Ernest Wilson & Co Limited, EW Leeds",https://media.rightmove.co.uk:443/dir/crop/10:9-16:9/154k/153122/124979429/153122_587398_IMG_00_0001_max_476x317.jpeg,nan,sale,"('53.8005568', '-1.5630613')",53.8005568,-1.5630613,168
